country,question_id,question,trait,high,moderately_high,medium,moderately_low,low
japan,0,"Imagine you are in the position of the young employee. While preparing the report, you find a creative way to visualize the data. How would you decide to present this idea to the director, considering the traditional office setting?",Openness to Experience,"I would enthusiastically prepare a detailed presentation, highlighting how this innovative approach aligns with our company's goals and seek an opportunity to discuss it directly with the director.","I would create a visual example and draft a concise summary, asking my supervisor for a chance to present it to the director during our next meeting.","I would prepare a brief mock-up and propose it to the team first, assessing their feedback before considering whether to bring it up with the director.",I would mention the idea in passing to my supervisor and gauge their interest before deciding if it's worth suggesting to the director.,"I would stick to the traditional format for the report, as introducing new ideas might not be well-received in our office environment."
japan,1,"Assume you are in the position of the young employee. Before the meeting with the director, how would you ensure that your report is not only thoroughly checked for errors but also perfectly formatted?",Conscientiousness,"I would triple-check every detail, cross-reference all data, and have colleagues review it to ensure absolute perfection.",I would carefully proofread it and ask a peer to review for any overlooked details before finalizing the format.,I would review it a couple of times and ensure that the format follows the usual standards.,I would quickly skim through for obvious errors and trust the basic formatting is sufficient.,"I’d glance at it briefly, assuming the initial draft was already good enough."
japan,2,"Imagine you are the young employee eager to make a strong impression. During the meeting with the director, how would you engage in conversation after presenting the report while respecting the formal office environment?",Extraversion,"I would enthusiastically initiate a discussion by asking for constructive feedback, and then share a few creative ideas I have for future projects.",I would confidently ask the director for their opinion on the report and gently introduce a couple of ideas I have been considering.,"I would express gratitude for the opportunity to present and ask a few questions about the report, staying open to hearing new insights.",I would thank the director for their time and ask if they have any comments or suggestions regarding the report.,"I would thank the director for the opportunity and quietly listen, making note of any remarks they might have."
japan,3,"Assume you are in the position of the young employee. If the director provides feedback that you find challenging, how would you handle the feedback while maintaining harmony and showing respect?",Agreeableness,"I would express gratitude for the feedback, assure the director of my understanding, and make necessary changes while seeking further advice to improve.","I would thank the director, reflect on the feedback, and politely ask questions to understand how I can implement the suggestions effectively.","I would acknowledge the feedback, discuss it with my director to clarify any doubts, and work on incorporating the changes where possible.","I would listen to the feedback, share my perspective calmly, and consider implementing the changes that align with my views.","I would hear the feedback, but only make changes I find relevant, while explaining my approach to the director."
japan,4,Imagine you are the young employee just before the meeting with the director. How do you manage feelings of anxiety or stress to remain composed as you present your report?,Neuroticism,"I can hardly control my nervousness, often feeling overwhelmed by anxiety even as I prepare, though I rely on deep breathing and visualization techniques to push through.","I feel quite tense and worried before the meeting, so I try to calm myself by reviewing my notes one last time and focusing on what I can control.","I experience moderate stress but manage by taking a few deep breaths, reminding myself of my preparation, and believing that I can handle any questions.","I feel a bit nervous, but I manage by reminding myself that everyone feels this way sometimes and trusting in my ability to present effectively.","I generally feel relaxed and confident before meetings, and I see them as opportunities to share my ideas rather than sources of stress."
japan,5,"Imagine you are at a Japanese family gathering where some guests introduce a fusion dish combining traditional Japanese flavors with international cuisine. How do you respond to trying the new dish, and what influences your reaction?",Openness to Experience,"I'm eager to try this new dish and explore the unique blend of flavors without hesitation, as I love discovering new culinary experiences.","I'm quite interested in trying the dish and appreciate the creativity involved, though I'll also enjoy familiar flavors if available.","I'm willing to try it to see how the flavors come together, but I also prefer to have some traditional dishes to rely on.","I might try it out of curiosity, but I feel more comfortable sticking to traditional dishes and tastes I know well.","I'd rather enjoy the traditional dishes I'm used to, as I'm not very inclined to experiment with unfamiliar food combinations."
japan,6,"Assume you are responsible for setting up a traditional Japanese family dinner. How do you ensure everything is prepared according to customs and traditions, and how do you double-check that nothing is missed?",Conscientiousness,"I create a detailed step-by-step checklist for each dish and decoration, consult older family members for their insights, and verify everything twice before the guests arrive.","I make a checklist of important tasks, refer to family notes on customs, and do a quick final review of all arrangements before dinner starts.","I follow a basic plan based on previous family gatherings and ensure the main components are in place, checking things as I go.",I set up as best as I can from memory and give things a general look-over to make sure the essentials have been covered.,I do my best to recall key aspects of the tradition and rely on others to mention anything I might have overlooked.
japan,7,"Imagine you find yourself in a lively conversation at a family gathering in Japan. How do you engage with family members during this social occasion, and how do you balance listening with sharing your own experiences?",Extraversion,"I enthusiastically participate by leading conversations, sharing my own experiences energetically, and encouraging others to join in by asking engaging questions.",I actively engage in the conversation by sharing interesting stories and asking others about theirs to keep the dialogue flowing.,I join in the conversation by sharing a few of my experiences and making sure to listen to what others have to say as well.,"I prefer to listen more than speak, occasionally sharing my thoughts when I feel my input would be appreciated.","I mostly listen quietly, nodding along and only speaking when directly asked a question or prompted to share."
japan,8,"Assume you are at a Japanese festival with family, and an elder asks for your help with carrying some festival items. How do you respond to their request, and what steps do you take to ensure their needs are met?",Agreeableness,"I gladly agree, carrying their items all the way to their destination, ensuring everything is perfectly arranged to their preference.","I accept and carry the items to their next destination, asking if there's anything else I can help with along the way.",I agree to carry the items to a nearby location they indicate and ensure they are settled there.,I offer to help by moving a few lighter items and suggest they might find assistance with the heavier ones.,"I politely excuse myself, mentioning that I might not be able to assist right now."
japan,9,"Imagine you are at a Japanese family dinner, and an unexpected topic of disagreement arises between relatives. How do you handle your emotions during this unexpected tension, and what strategies do you use to maintain composure?",Neuroticism,"I feel extremely anxious during the disagreement, and find it difficult to conceal my emotions, although I try to remain calm by focusing on my breathing.","I am quite uneasy with the tension and occasionally show signs of stress, but I manage to keep my composure by staying silent and observant.",I feel slightly uncomfortable but manage to stay even-tempered by redirecting the conversation when possible.,"I notice the tension but remain relatively calm, focusing on the meal and occasionally contributing to easing the mood.","I handle the situation with ease, staying calm and unaffected while encouraging a light-hearted conversation."
japan,10,Imagine you are a student in the classroom observing your classmates demonstrate this traditional form of respect. How do you feel about the idea of maintaining such traditions in a modern learning environment?,Openness to Experience,I find it fascinating and believe that incorporating traditional practices enriches our learning experience.,"I see value in preserving these traditions, as they can complement and enhance our education.","I appreciate the tradition, but I think it should be balanced with modern teaching methods.","I feel that while traditions are important, they might sometimes hinder our adaptation to new ways of learning.",I think tradition may not have much place in modern education and could slow down progress.
japan,11,Assume you are in the position where you are slightly late to class as everyone stands and bows. How do you ensure you follow the proper protocol without disrupting the class?,Conscientiousness,"I quietly enter the room, close the door softly, and wait until the students finish bowing before taking my seat.",I enter the room quietly and bow at the door discreetly before heading to my seat.,I enter and nod respectfully towards the class before sitting down quickly.,I enter the room somewhat quietly and take my seat without making much noise.,I walk in as usual and find my seat without paying particular attention to the ongoing bow.
japan,12,"Imagine you are standing in your classroom, waiting for the teacher's cue to sit. How do you interact with your classmates in the moments before and after this ritual?",Extraversion,"I eagerly engage in lively conversations with several classmates, making jokes and sharing stories.","I chat with a few classmates nearby, keeping the conversation pleasant and engaging.",I exchange some greetings and casual comments with a couple of classmates.,I acknowledge my classmates with a polite nod or smile but keep mostly to myself.,"I stand quietly, focusing on the teacher or my own thoughts without initiating conversation."
japan,13,Assume you notice a new student is unsure of the bowing practice. How do you assist them in understanding and participating in this tradition?,Agreeableness,"I would approach them with a warm smile, explain the significance of bowing in Japanese culture, and offer to practice bowing together until they feel comfortable.",I would kindly explain the basics of bowing and offer some friendly tips to help them get more familiar with it.,I would give them a brief explanation about bowing and suggest that they observe others for different contexts.,I'd mention that bowing is important and suggest they look it up or watch others to learn.,"I would suggest they ask someone else, mentioning that it is common to bow in greetings."
japan,14,"Imagine that the teacher enters the room unexpectedly, and you're unsure about when to bow. How do you handle your anxiety or discomfort in this situation?",Neuroticism,"I start feeling extremely anxious and start sweating, my mind races with thoughts of doing the wrong thing.","I feel quite anxious and uncertain, but I try to guess the right moment to bow even though it makes me nervous.","I feel a bit nervous, but I take a moment to observe others and then follow their lead.","I'm only slightly concerned, so I decide to bow casually when it feels appropriate.","I don't feel anxious, trusting that I will know the right moment to bow without overthinking."
japan,15,"Imagine you are the apprentice serving tea, and the master suggests adding an unusual ingredient to the tea. How do you respond to this suggestion?",Openness to Experience,I express enthusiastic curiosity and immediately suggest experimenting with this new ingredient.,I show keen interest and discuss with the master how we might incorporate the ingredient.,"I listen thoughtfully to the suggestion, expressing a willingness to try it out after consideration.","I express slight uncertainty and prefer to stick to traditional methods, but agree to try it if the master insists.","I politely express hesitation, preferring to follow familiar practices and avoid potential risks."
japan,16,"Assume you are in the position of ensuring the tea ceremony proceeds perfectly, even if it requires additional effort outside of your normal routine. How do you handle this responsibility?",Conscientiousness,I meticulously plan every detail ahead of time and put in extra hours to ensure everything is flawless.,I make a detailed checklist and dedicate extra time to cover all important steps to make the ceremony successful.,I ensure all key aspects are covered and seek assistance if necessary to keep things running smoothly.,I prepare the basics and hope that unforeseen details will work themselves out during the ceremony.,"I rely on my usual routine, addressing issues only if they arise during the tea ceremony."
japan,17,"Imagine as the apprentice, you have the opportunity to engage in a discussion with your master about the tea ceremony. How do you initiate or contribute to the conversation?",Extraversion,I eagerly start by asking my master about their most memorable experiences with the tea ceremony and share my thoughts on how it makes me feel calm and connected.,I ask my master about specific techniques they enjoy the most and mention my curiosity about exploring different tea ceremony styles.,I inquire about the essential aspects of the tea ceremony and express a desire to understand its symbolism.,I listen to my master explain the tea ceremony and occasionally ask for clarification on parts I don't understand.,I quietly listen to my master and wait for any direct questions or pointers they might have for me.
japan,18,"During the tea ceremony, the master requests a change in the seating arrangement that affects other apprentices. How do you address the master's request while considering the others involved?",Agreeableness,"I will immediately and smilingly communicate the change to everyone, and ensure all feel comfortable and understand the master's wisdom in this change.","I will inform everyone of the master's request, politely explaining the reasoning, and check if anyone needs help adjusting.",I will convey the master's wishes and ask if everyone is okay with the new seating plan.,I will let everyone know about the change and suggest they arrange themselves as requested.,I will simply announce the new arrangement and leave it to the others to follow the master's instructions.
japan,19,"Imagine you are serving tea, and you accidentally spill a small amount. How do you react to this unexpected mistake in front of your master?",Neuroticism,"I immediately feel extremely embarrassed and worry that my master will be very disappointed in me, and I keep thinking about it for the rest of the day.","I feel quite anxious and apologize profusely, hoping this doesn't affect their opinion of my diligence.","I acknowledge my mistake and apologize sincerely, deciding to be more careful in the future but accepting that mistakes happen.","I apologize and make a mental note to be more attentive, but quickly move on without too much worry.","I simply apologize and calmly clean up the spill, understanding that such minor mistakes are a natural part of learning."
japan,20,"Imagine you are at the Shinto shrine festival, and you overhear the elders telling a story about a mystical creature said to guard the village. How do you react to this tale and what do you do with this newfound piece of folklore?",Openness to Experience,"I am fascinated and decide to immerse myself in local folklore, even considering including it in a creative project or sharing it with others.",I find the story intriguing and decide to learn more by talking to the elders or reading up on local legends.,I enjoy hearing about such stories and might mention it to friends casually or think about it occasionally.,I acknowledge the tale as an interesting cultural aspect but don’t feel particularly engaged to explore further.,I assume it is a part of tradition and don’t give it much thought or attention beyond polite interest.
japan,21,Assume you are in the position of the young boy who has been tasked with remembering and documenting the stories told by the elders. What steps do you take to ensure that you accurately preserve these narratives for future generations?,Conscientiousness,"I dedicate a specific notebook for these stories and meticulously write down every detail, regularly cross-referencing with the elders to ensure accuracy.","I make sure to listen intently, take detailed notes during each session, and review them to fill any gaps soon after.",I record the main points of the stories and discuss with elders occasionally to verify my notes.,I jot down key highlights of the stories when convenient and ask for clarification from elders if necessary.,"I try to remember the stories and write them down if I need them later, but mostly rely on my memory."
japan,22,Consider yourself mingling at the Shinto shrine festival when you notice a group of children interested in the ongoing stories. How do you engage with them and share your passion for these tales?,Extraversion,"I gather the children around and enthusiastically retell the stories with lively expressions and gestures, encouraging them to join in with questions and comments.","I approach the group, share some intriguing facts about the stories, and invite them to talk and ask questions about the tales.","I smile and share a few interesting points about the stories, being open to any questions the children might have.","I offer a brief explanation of the stories from a distance, allowing the children to listen in quietly.","I simply observe from afar, only offering a nod or smile if any child looks my way."
japan,23,"Picture yourself listening to the elders tell stories at the festival, and they invite you to share your own thoughts or experiences related to the village traditions. How do you approach participating in this conversation?",Agreeableness,"I enthusiastically express my gratitude to the elders for sharing their wisdom and share my thoughts with warmth and respect, ensuring I'm honoring their traditions.","I politely thank the elders and share my thoughts, making sure to align them with the values of the village traditions.",I express a balanced appreciation for the storytelling and share my experiences in a way that acknowledges the elders' perspectives.,"I listen thoughtfully and share my thoughts, but I slightly prioritize my own perspective over fully agreeing with the elders.","I listen to the stories and briefly share my thoughts, but I don't make much effort to align with the elders' views."
japan,24,"Imagine you are at the festival, feeling overwhelmed by the responsibilities of preserving the village's stories. What thoughts run through your mind, and how do you manage your emotions in this scenario?",Neuroticism,"I feel a surge of anxiety, questioning my capability to do justice to these stories, and find it difficult to focus, needing to take deep breaths to calm my racing heart.","I start to worry about the details and wonder if I might forget something important, so I take a moment to gather my thoughts and make mental notes of key points.","I recognize the pressure but reassure myself that I've prepared well, and decide to focus on one story at a time.","I'm aware of my responsibilities but quickly remind myself that perfection isn't necessary, and focus on enjoying the festival atmosphere.","I remain calm, assured that everything will unfold naturally as I've practiced, and immerse myself in the festivities."
japan,25,"Imagine you are the junior worker discussing a project proposal with your senior team leader. They suggest a traditional approach, but you have a creative, unconventional idea in mind. How do you handle the situation?",Openness to Experience,"I confidently present my unconventional idea and explain how it could bring unique benefits to the project, even suggesting a small trial to demonstrate its potential.","I propose my creative idea as an alternative, highlighting its potential advantages, and suggest we consider it alongside the traditional approach.","I briefly mention my idea and express willingness to explore it further if there's interest, while respecting the traditional approach suggested.","I keep my idea in mind, but decide to follow the traditional approach unless asked for alternative suggestions.","I agree to the traditional approach without mentioning my idea, trusting in the experience of my senior team leader."
japan,26,Assume you are in the position of the junior worker and are tasked with making a decision that aligns with the company values. How do you ensure that you leave no detail overlooked while validating this alignment?,Conscientiousness,"I meticulously review all company guidelines, consult multiple experienced colleagues, and seek feedback on my decision to ensure no detail is overlooked.","I carefully go through company policies, consult with a senior colleague, and double-check my work to align it closely with the company's values.",I review the relevant guidelines and ask a colleague for a quick insight to ensure my decision aligns with the values.,I glance over the company policies and rely mostly on my judgment while considering the values.,"I quickly skim the guidelines and make the decision based on what I assume aligns with the values, without seeking further input."
japan,27,Imagine you are the junior worker and you have an opportunity to present ideas to the senior team leader in a group meeting. How do you approach communicating your thoughts during this interaction?,Extraversion,"I confidently take the initiative to speak first and clearly express my creative ideas, actively engaging everyone in the discussion.",I eagerly share my ideas with enthusiasm and try to involve others by asking their opinions.,I share my ideas when it feels appropriate and contribute to the discussion without pushing too hard for attention.,I wait for others to speak first and then quietly add my thoughts when prompted or when a good opportunity arises.,"I prefer to listen and observe during the meeting, only speaking if directly asked about my thoughts."
japan,28,"Assume you are the junior worker discussing an idea with the senior team leader and they disagree with your perspective. How do you respond to ensure a harmonious relationship, while conveying your point?",Agreeableness,"I would sincerely thank them for their feedback, express understanding of their viewpoint, and gently suggest a small joint discussion to explore the best aspects of each idea.","I would acknowledge their perspective respectfully, and then propose alternative ideas, inviting them to think of possible integration with their plan.","I would listen to their concerns, share my thoughts candidly, and suggest we consider both ideas before making a decision.","I would express why I think my idea has merit, but also agree to their approach to maintain harmony until I have more evidence.",I would state my opinion and express some disagreement but agree to go along with their decision for the team’s sake.
japan,29,Imagine you face a setback after consulting with your senior team leader and realizing you may have misinterpreted some key information. How do you manage your emotions and proceed with resolving this issue?,Neuroticism,I find myself deeply worried and anxious about the mistake; I need some time to calm down before taking any corrective action.,"I definitely feel concerned and may dwell a bit on the error, but I try to focus on finding a solution quickly.","I acknowledge the mix-up and feel a bit stressed, but I’ll calm myself and work on a plan to address it.","I understand that mistakes happen and feel slightly uneasy, but I can address the issue without excessive worry.",I remain fairly composed and try not to let emotions influence my decision as I work to resolve the mistake.
japan,30,"Imagine you are part of the youngest generation in a traditional Japanese family business. During a meeting, the family patriarch introduces a radical new idea that challenges conventional business methods. How do you react to this new idea?",Openness to Experience,"I enthusiastically embrace the idea, eager to explore the potential it holds for innovating our business.",I express interest and suggest we experiment with the idea on a small scale to understand its impact.,I consider the idea thoughtfully and suggest we discuss it further to weigh the pros and cons.,I show some hesitation and recommend that we make only minor adjustments to align it with our tradition.,I voice my concerns about deviating from our proven methods and suggest sticking to what has worked for us in the past.
