country,question_id,question,trait,high,moderately_high,medium,moderately_low,low
brazil,128,"Assume you are joining Ana in discussing housing options with her parents, who have their preferences for certain neighborhoods. How do you navigate and respond to their suggestions during the conversation?",Agreeableness,"I express appreciation for their input, agreeing enthusiastically while suggesting we balance their preferences with Ana's needs to reach a consensus.",I thank them for their suggestions and calmly discuss how we can incorporate both Ana's preferences and theirs into the decision.,I acknowledge their preferences and offer to explore how these align with Ana's priorities during our decision-making process.,"I listen quietly and make a note of their preferences, but steer the conversation back towards what Ana prefers without much engagement.","I focus mainly on Ana's preferences and suggest firmly that we prioritize her choices, treating their suggestions as secondary."
brazil,129,"Imagine you are Ana, feeling the pressure of choosing the perfect location for your family, with the potential stress of what-ifs looming in your mind. How do you manage your emotions and decision-making process in this scenario?",Neuroticism,"I often find myself overwhelmed with anxiety and run through all possible negative outcomes, struggling to make a decision and feeling quite stressed throughout.","I feel anxious about making the wrong choice, so I spend a lot of time researching and worrying about the potential pitfalls of each option.","I acknowledge the stress but try to weigh the pros and cons calmly, seeking advice from family to help balance my emotions and decisions.","I experience some worry but prioritize staying rational, focusing on the positive aspects and practical considerations of each option.","I remain calm and confident, trusting my ability to manage the decision efficiently without getting bogged down by potential stresses or what-ifs."
brazil,130,"Imagine you are at the family reunion at the farm, and Carlos suggests trying a traditional Brazilian activity that you've never experienced before, such as dancing to Forró music or learning to prepare an indigenous dish. How do you respond to his suggestion?",Openness to Experience,That sounds amazing! I can't wait to try something new and dive into it wholeheartedly.,I'd love to give it a try; it sounds like a fun way to learn more about our culture.,"I'm open to the idea, let's see how it goes.","I'm a bit hesitant, but I might give it a shot if everyone else is doing it.",I think I'll pass and stick to what I'm comfortable with.
brazil,131,"Assume you are in charge of organizing the meal plan for the family reunion, ensuring every relative's dietary preferences and restrictions are considered. How do you approach this task to make sure everything runs smoothly?",Conscientiousness,"I create detailed spreadsheets, reach out individually to confirm preferences, and develop a comprehensive plan well in advance.","I make a list of everyone's preferences, plan a variety of dishes, and double-check with a few family members to ensure inclusivity.","I jot down the main preferences mentioned, select some crowd-pleasers, and hope it suits most family members.",I ask around for general preferences and try to incorporate them as best as I can without diving into too much detail.,I prepare a standard menu that should work for most and don't focus much on individual preferences.
brazil,132,"Imagine it's the first night of the reunion, and everyone is gathered around a campfire sharing stories. Do you find yourself actively participating in conversations and initiating new topics, or do you prefer to listen and occasionally contribute?",Extraversion,"I love jumping in, sharing my stories, and encouraging others to do the same!",I enjoy joining the conversation and suggesting new topics whenever I can.,"I participate when I feel like I have something to add, but I'm also happy to listen.",I mostly enjoy listening but will speak up if the topic really interests me.,I prefer to listen and only contribute when directly asked.
brazil,133,"During the reunion, a small disagreement arises between two family members about the best way to organize future reunions. How do you intervene or help to resolve the situation?",Agreeableness,"I actively listen to both sides, empathize with their points of view, and suggest a compromise that incorporates ideas from both family members.",I open a dialogue where both family members can discuss their perspectives and encourage them to find a middle ground.,I acknowledge the disagreement and suggest they consider a solution that could work for most attendees.,I politely suggest taking a break from the discussion to think things over and perhaps revisit it later.,I decide not to get involved and let them sort it out on their own.
brazil,134,"Picture you're preparing for an important group activity at the reunion, and things aren't going as planned, causing some unforeseen stress. How do you handle these unexpected changes and maintain your composure?",Neuroticism,"I find myself feeling overwhelmed and anxious, which makes it hard for me to focus, but I try to breathe deeply and seek support from friends to stay calm.","I feel a bit nervous and stressed, and take a moment to gather my thoughts, reminding myself to stay positive and adapt to the situation.","I notice some stress but try to stay focused on finding a solution, balancing my emotions with actions.",I feel slightly uneasy but quickly start looking for ways to adjust our plans and keep things moving forward.,"I stay calm and collected, viewing these changes as part of the challenge and focusing on finding solutions."
brazil,135,"Imagine you are Sandra planning a day with your nieces and nephews. They are excited to try something new, like going to a Capoeira workshop. How do you feel about organizing this adventure with them?",Openness to Experience,I am thrilled about organizing the Capoeira workshop and can't wait to experience this cultural adventure together with my nieces and nephews.,"I'm quite interested in planning the Capoeira workshop, as it sounds like an exciting and enriching activity for all of us.","I'm open to exploring the idea of a Capoeira workshop with them, as it could be an interesting experience.","I'm a bit hesitant about organizing something so new, but I could give it a try if that's what they really want.",I'm not very excited about planning something unfamiliar like a Capoeira workshop and prefer sticking to activities we know.
brazil,136,Assume you are Sandra preparing meals for your younger brother's children. You want to make sure their nutrition needs are well balanced. How do you plan and manage the meals over the week to ensure everything is taken care of?,Conscientiousness,"I create a detailed weekly meal plan with balanced nutrition, shop for fresh ingredients on Sundays, and label each day’s meals in advance.","I draft a meal plan for the week, focusing on key nutritional needs and ensure I shop for ingredients every few days.","I make a mental note of the meals and try to ensure variety and nutrition as the week progresses, adjusting as needed.","I prepare meals based on what's available at home, occasionally checking that they meet basic nutritional guidelines.","I cook meals spontaneously each day with whatever ingredients are at hand, giving minimal thought to a nutritional balance."
brazil,137,"You're Sandra at a large family gathering in Brazil, and your younger brother's children are naturally shy around others. How do you involve them in group activities to make them feel comfortable amidst the crowd?",Extraversion,"I enthusiastically introduce them to everyone, organize a samba dance competition for them, and encourage them to join me in leading a group game.",I introduce them to a few relatives and suggest that they join me in a team for a fun scavenger hunt.,I gently introduce them to one or two relatives and invite them to participate in a group game I am organizing.,"I ask them if they want to join a group activity, but I don’t push if they seem uninterested.",I let them decide if they want to join the activities and stay nearby to provide support if needed.
brazil,138,"Picture yourself as Sandra, and your younger brother and sister-in-law are very stressed from work. They call you at the last minute asking if you could watch the kids. How do you respond to their request considering they often rely on you?",Agreeableness,"Of course, I'd be happy to watch the kids; I understand how tough work can be.","I can help out today, although next time, let's try to plan a bit more in advance.","I'll watch them this time, but we should discuss a more regular arrangement.","I'm a bit busy, but I could help this time if it's really necessary.","I'm sorry, I can't help today; perhaps you can find another option."
brazil,139,"Imagine you are Sandra, and you have to handle a tense situation where the children are arguing over what game to play. How do you react to mediate the situation and maintain your calmness?",Neuroticism,"I become very anxious, feeling overwhelmed by the noise and stress, and I raise my voice while trying to get them to stop arguing.",I feel quite stressed and struggle to find the right words but manage to suggest a compromise while feeling tense.,"I experience some worry and indecision, but I try to calmly suggest a game rotation plan after a slight hesitation.",I feel a bit uneasy but manage to stay composed enough to suggest that they each choose a game for a short time.,"I remain calm and collected, suggesting a solution with ease and without much stress."
brazil,140,"Imagine you are Luiz, planning to embark on a new adventure like starting a business in Brazil. Would you be willing to seek innovative ideas beyond your father's and uncles' traditional advice, even if it involves riskier but exciting paths?",Openness to Experience,"Absolutely, I am eager to explore innovative ideas and take on challenges beyond traditional methods.","Yes, I am open to considering new ideas and exploring paths that might be a bit risky but promising.",I am willing to take some new steps but would also like to balance traditional advice with new concepts.,"I might consider some new ideas, but I feel more comfortable sticking mostly to the tried and true methods.",I prefer to follow the traditional advice from my family and not venture into unfamiliar territories.
brazil,141,Assume you are in Luiz's position and you receive detailed advice from your father and uncles about carefully planning your career path. How would you organize and prioritize this guidance to ensure you meet your goals without overlooking any important details?,Conscientiousness,"I would create a comprehensive, step-by-step action plan with deadlines and track my progress regularly to incorporate all their advice systematically.","I would outline the key advice points in a list, prioritize them by importance, and review my progress monthly to make adjustments.","I would write down the main advice, try to incorporate it into my current plans, and check back occasionally to see if I'm on track.","I would keep their guidance in mind, applying it as situations arise, but mainly focus on immediate tasks at hand.","I would listen to their advice but prefer to go with the flow, adapting their suggestions as I feel necessary."
brazil,142,"Imagine you are Luiz at a lively family gathering where you have the chance to discuss your decision-making process with your relatives. How actively would you engage in conversations, and would you share your thoughts and seek opinions openly with enthusiasm?",Extraversion,"I would actively engage with everyone, passionately sharing my thoughts and eagerly seeking opinions from all my relatives.","I would be quite involved, sharing my thoughts with enthusiasm and asking for feedback from several family members.","I would participate in discussions, sharing my thoughts with a few relatives and considering their feedback.",I might share my thoughts with one or two relatives but wouldn't actively seek out many opinions.,"I would stay mostly reserved, just listening to others and keeping my thoughts to myself."
brazil,143,"Assume you are Luiz and your father and uncles present differing viewpoints on a career decision. How would you navigate this situation to ensure all parties feel respected and heard, while still being able to reach your own decision?",Agreeableness,"I would actively listen to each perspective and make sure to validate their opinions before sharing my thoughts, aiming to incorporate some of their suggestions into my decision.","I would respectfully consider each viewpoint and express gratitude for their advice, carefully explaining my decision and how it aligns with some of their inputs.","I would hear out their perspectives, thank them for their input, and then communicate my decision while pointing out any areas of agreement.","I would listen to their opinions, acknowledge them briefly, and then explain my decision and reasoning straightforwardly without much reference to their views.","I would listen to their viewpoints, but ultimately make my own decision without much discussion about their opinions."
brazil,144,Imagine you are Luiz and you feel anxious about making a big life decision despite having your family's support. How do you manage these feelings and do you lean on additional reassurances from them to feel more secure about your choice?,Neuroticism,"I constantly revisit discussions with my family, seeking more affirmation and frequent reassurance to quell my anxiety.",I discuss my concerns with my family a few more times to gain some extra reassurance and manage my feelings.,I lean on the support my family has already given and try to balance it with self-reflection to manage my anxiety.,"I've received their support, which comforts me; I focus on decisively moving forward instead of seeking further reassurance.",I rely on my initial discussion with my family and focus on my own confidence to manage my decision-making.
brazil,145,"Imagine you are Silvia, experiencing your first Carnival in Brazil. You encounter a parade with costumes and music unfamiliar to you. How do you engage with these new cultural elements and what actions do you take to immerse yourself in this fresh experience?",Openness to Experience,"I eagerly join the parade, dance with the performers, ask about the symbolism of the costumes, and try to play the traditional instruments to fully embrace and understand this vibrant culture.","I dance along the sidelines, chat with locals to learn more about the traditions, and take photos to remember the experience.","I enjoy watching the parade, take some pictures, and ask a few questions about the festival from a distance.","I observe the parade quietly from a spot where I can see clearly, appreciating the performance but preferring not to engage too deeply.","I watch the parade from a distance, taking in the music and costumes without actively participating or attempting to learn more."
brazil,146,"Assume you are Silvia, responsible for organizing your family's Carnival schedule. How do you prepare and coordinate the events to ensure everyone enjoys the festivities together while maintaining personal commitments?",Conscientiousness,"I create a detailed itinerary for each day, incorporating input from all family members, and set reminders for everyone to stay on track.","I organize a flexible schedule with key highlights and share it with the family, ensuring we all have room for personal interests.","I suggest a few main events to attend so everyone has a general idea of what's happening, while leaving plenty of free time.","I jot down some popular events for us to consider but leave the final decisions to spontaneous, day-of planning.",I trust that everyone will figure out their own plans and meet up if and when it feels right.
brazil,147,"Imagine you are Silvia during Carnival. As the parade approaches, you find yourself in a crowd of lively strangers. What steps do you take to either seek out more social interactions or find a comfortable space for yourself?",Extraversion,"I jump into the crowd, making new friends and joining in every dance and conversation.","I engage with some of the people around me, sharing smiles and small talks while enjoying the vibrant atmosphere.","I chat a bit with those nearby, enjoying the energy but staying close to familiar faces or quieter spots.","I find a quieter spot nearby, watching the parade from a distance but enjoying the ambiance.","I retreat to a quieter area away from the crowd, preferring to watch the parade on my own."
brazil,148,Assume you are Silvia at a family gathering before a parade during Carnival. A conflict arises over differing plans for the day. How do you handle the situation to ensure harmony among family members?,Agreeableness,"I listen to everyone's opinions and suggest a compromise that makes everyone happy, ensuring we all enjoy the Carnival together.",I try to mediate by encouraging everyone to share their thoughts and suggest a plan that incorporates as much as possible from everyone's ideas.,"I propose a plan that balances the main preferences expressed, hoping it satisfies most of the family.","I suggest sticking to the original plan even if it means not everyone agrees, aiming to keep things simple.","I state my own preference and encourage others to join, letting them decide if they want to follow or not."
brazil,149,"Imagine you are Silvia, feeling overwhelmed by the noise and energy of the Carnival parade. What actions do you take to manage your emotions and maintain a sense of calm during the celebration?",Neuroticism,"I find a quiet spot away from the parade, put on noise-canceling headphones, and do breathing exercises to regain my calm.","I step back a little from the crowd, take a few deep breaths, and remind myself to enjoy the moment.","I try to focus on enjoying the music and colors, telling myself it's just part of the experience.","I continue to stay with the group, even if it's a bit overwhelming, knowing the feeling will pass.","I ignore the overwhelming feeling and immerse myself fully in the parade, not letting it bother me."
brazil,150,Imagine you are at the Rio Carnival and you have the opportunity to join a samba school to learn their dance routine combining African rhythms and Portuguese traditions. How would you approach this new cultural experience?,Openness to Experience,"I would eagerly join the samba school, fully immersing myself in the dance routine and embracing this vibrant cultural fusion with enthusiasm.","I would be quite excited to participate, learning the dance routine and enjoying the unique blend of rhythms and traditions.",I would feel interested in trying out the dance routine and understanding this cultural mix if it fits into my schedule.,"I might watch the samba school but would probably prefer not to participate, focusing on other aspects of the Carnival.","I would choose to skip the samba school and stick to familiar activities at the Carnival, as I'm not keen on joining the dance routine."
brazil,151,"During the Carnival parade, you are in charge of ensuring that all the costumes are ready and perfect before the performance begins. How would you plan and manage your responsibilities to guarantee a flawless presentation?",Conscientiousness,"I would create a detailed checklist, double-check every costume the day before, and conduct a final inspection a few hours prior to the parade to ensure perfection.",I would ensure all costumes are ready the day before and perform a quick review shortly before the parade to catch any last-minute issues.,I would confirm that most costumes are prepared ahead of the parade and rely on reminders to keep track of anything crucial.,I would plan to organize the costumes on the same day of the parade and hope that any minor issues can be quickly fixed on the spot.,I would trust that the costumes are ready without doing much additional checking and only address problems as they come up during the parade.
brazil,152,"Assume you are in the middle of a vibrant crowd at the Carnival, surrounded by people dancing and celebrating. How do you engage with the energy and the people around you during this festive event?",Extraversion,"I dive right into the heart of the celebration, dancing with everyone around and striking up conversations with as many people as possible.","I join the dancing and make an effort to meet new people, enjoying the lively atmosphere.",I enjoy the celebration by dancing with my friends and occasionally chatting with people nearby.,"I smile and observe, engaging mainly with my friends and occasionally joining the dancing.","I stay on the sidelines, enjoying the music and energy mostly from a distance while staying close to my group."
brazil,153,"While participating in the Carnival parade, a fellow dancer is feeling nervous about performing. How would you support and motivate them to ensure they're comfortable and ready to perform?",Agreeableness,"I would spend time reassuring them, offering a pep talk, and practicing with them until they feel fully confident.",I would encourage them by sharing calming techniques that have worked for me and offering to stay by their side before the performance.,I would offer some encouraging words and suggest they take a few deep breaths to relax.,I might point out that they’ve practiced a lot and the effort will show on stage.,"I would tell them to follow their instincts and calm themselves, as everyone feels nervous sometimes."
brazil,154,"Imagine you are preparing for the Carnival and things aren't going as planned, with a lot of unexpected challenges. How do you manage your stress and emotions in these moments to ensure you still enjoy the event?",Neuroticism,"I feel overwhelmed and constantly worry about keeping everything under control, but I remind myself that it's important to persist and make the best of the situation.","I experience some anxiety and try to focus on finding solutions, reminding myself to take breaks to manage my stress levels.",I acknowledge the stress but try to balance my emotions by focusing on the positive aspects and the overall excitement of Carnival.,"I try not to let the challenges bother me too much and keep a positive outlook, addressing the issues as they come.","I remain calm and relaxed, confident that things will work out and focusing on having a good time regardless of obstacles."
brazil,155,"Imagine you are in a Brazilian household where you're being offered feijoada and pão de queijo, unfamiliar yet enticing dishes. How inclined are you to try these traditional Brazilian meals and explore their flavors?",Openness to Experience,I'm eager to dive into these traditional dishes and immerse myself in the richness of Brazilian flavors.,I'm quite interested in trying these dishes and getting a taste of Brazilian cuisine.,"I’m open to giving these dishes a try, though I'm not sure how much I'll enjoy them.","I'll have a small taste, but I'm a bit hesitant about unfamiliar foods.",I'm not comfortable trying unfamiliar dishes and prefer to stick to what I know.
brazil,156,"Assume you are in charge of preparing a meal for a gathering in the household. How do you go about planning and executing the preparation of the complex feijoada, ensuring each ingredient is carefully selected and cooked?",Conscientiousness,"I meticulously plan every detail, from sourcing the finest ingredients to creating a timeline for each step, ensuring everything is executed flawlessly.","I create a detailed list of ingredients and cooking steps, leaving some room for adjustments if needed.","I gather most of the ingredients and follow a general plan, making necessary improvisations along the way.","I choose the main ingredients but keep the process flexible, figuring things out as I cook.","I focus on a few key ingredients and decide on the steps as I go, not worrying too much about the details."
brazil,157,"Picture yourself at a lively family dinner in a Brazilian home, surrounded by animated discussions and laughter. How do you engage with the people around the table to ensure you're a part of the vibrant conversations about the feijoada and pão de queijo?",Extraversion,"I energetically share my thoughts on the dishes, ask others their opinions, and initiate lively stories about my own experiences with Brazilian cuisine.","I join in the conversation, adding my thoughts on the feijoada and pão de queijo, and ask others what they think as well.",I occasionally add my opinion when something interesting about the food comes up and try to listen to what others have to say.,I listen to the conversations and contribute a few words if directly asked about the food.,"I mostly listen and observe, quietly appreciating the lively atmosphere and the food without speaking much."
brazil,158,Imagine a family member strongly insists on using a specific recipe for the feijoada that you have doubts about. How do you navigate this situation to maintain peace and perhaps reach a compromise?,Agreeableness,"I would happily agree to use their recipe, valuing their input and assuring them I'll appreciate the meal either way.","I would suggest trying their recipe while adding a small twist, ensuring both ideas are incorporated.","I would propose we try their recipe this time and mine next time, to keep it fair.",I would express my concerns about the recipe but agree to try it if they feel strongly about it.,"I would politely insist on using my preferred recipe, explaining my doubts about their choice."
