country,question_id,question,trait,high,moderately_high,medium,moderately_low,low
japan,346,Assume you are preparing for your visit to the shrine for hatsumode. How meticulously do you plan your offerings and prayers to ensure everything is done correctly according to tradition?,Conscientiousness,"I create a detailed checklist to ensure every offering is correctly prepared, and I research the prayers to recite them perfectly.",I organize a list of items needed and make sure I review the key aspects of prayers before visiting.,I have a general idea of what to bring and refer to tradition guidelines on the day of the visit.,I make a basic offering and try to follow the prayer routine as best as I remember.,I make spontaneous offerings and use the time for self-reflection without following specific traditions.
japan,347,Imagine you encounter a group of friends at the shrine who invite you to join them in their hatsumode celebrations. How enthusiastic are you about spending the day engaging with them in the festivities?,Extraversion,I'm thrilled to join them and can't wait to participate in all the activities together.,I'm quite excited and looking forward to spending an enjoyable day with them.,I think it would be nice to join them for a while and see how the day unfolds.,"I'm a bit hesitant, but I'll join for a short while to see how it goes.",I'm not very interested in socializing today and would prefer to keep to myself.
japan,348,Assume you are in the position of witnessing a stranger struggling with their offerings or prayers at the shrine. How inclined are you to approach them and offer your assistance or guidance?,Agreeableness,"I will certainly approach them and offer my help immediately, ensuring they feel comfortable and supported.","I think it's important to offer assistance, so I will gently ask if they need help and guide them if they wish.","If they seem to need it, I might offer help but would prefer to wait and see if they indicate they want assistance.","I might not approach directly as they might find it intrusive, but I'll be nearby in case they ask for help.","I believe they will figure it out, so I would not intervene unless explicitly requested to do so."
japan,349,"Imagine you are at the shrine and it's a crowded day, making it difficult to find a quiet moment for your prayers. How much do you find yourself feeling stressed or overwhelmed by the situation?",Neuroticism,"I feel quite stressed and can't seem to focus on my prayers, constantly worrying about the crowd around me.","I feel somewhat overwhelmed by the situation, but I try to continue with my prayers despite the distractions.","I notice the crowd, and while it is a bit distracting, I manage to focus on my prayers with some effort.","I’m slightly aware of the noise but mostly unfazed, allowing myself to immerse in the prayer ceremony.","Crowds don’t bother me at all, and I find peace in my prayers regardless of the people around."
japan,350,Imagine you are one of the volunteers teaching the students. You find a new method to explain a difficult concept that differs from traditional techniques. Would you try this new approach despite the risk of it not working as well as the old one?,Openness to Experience,"Absolutely, I'm excited to try innovative ways to see how they can improve the learning experience.",I would give it a try and see how the students respond to the new method.,I might try the new approach after considering its potential benefits and any possible drawbacks.,I would be hesitant but might try it if more traditional methods were not effective.,I prefer to stick with the traditional method that I know works well for the students.
japan,351,Assume you are responsible for preparing the classroom for the study sessions every morning. How would you ensure that everything is ready and orderly for the students' arrival?,Conscientiousness,"I would create a detailed checklist, arrive early every day, and double-check each item to ensure everything is perfectly in place.","I would prepare the evening before, arrive a bit early, and quickly go through my checklist to ensure readiness.","I would plan to arrive on time, do a quick check of the room, and trust my routine for preparations.",I would come at the scheduled time and rely on memory to set things up without much checking.,I rely on improvisation and adjust things quickly as needed when I arrive with the students.
japan,352,"Imagine you are at the study session where students are gathering and interacting. How would you engage with the students, and would you actively initiate conversations with them?",Extraversion,"I would enthusiastically greet everyone, introduce myself to new faces, and initiate lively discussions with different groups throughout the session.",I would engage actively by joining in discussions and start conversations with a few people around me to share ideas and experiences.,I would participate in discussions when approached and engage with those around me at a comfortable pace.,"I would mainly focus on my own work but interact if someone starts a conversation with me, keeping to small groups.","I would keep to myself, focusing on studying and only engage in conversation if absolutely necessary."
japan,353,"Assume you notice a fellow volunteer struggling to manage a group of students. How would you approach the situation, and to what extent would you offer your assistance?",Agreeableness,"I would immediately step in, offer my full assistance, and actively help manage the group until everything is under control.","I would approach them and offer to help with specific tasks to lighten their load, staying until they're comfortable handling the students.",I would ask if they need any help and assist with a few tasks if they seem to require support.,I would watch from a distance to see if they stabilize the situation before offering minimal assistance if they appear to still need help.,I would assume they can handle it on their own and not intervene unless specifically asked for help.
japan,354,"Imagine you face a situation where a student accidentally spills their drink all over study materials right before the session. How do you react emotionally, and what steps do you take to handle the situation?",Neuroticism,"I would feel very stressed and anxious, worrying about how to recover the materials, and might need a moment to calm down before taking action.","I might feel a bit overwhelmed initially, but I would quickly start thinking about possible solutions to minimize the impact on the session.","I'd feel concerned but stay composed, reassuring the student while arranging for backup materials if possible.",I’d be a little annoyed but would focus on quickly finding a way to replace or clean the materials without much fuss.,"I would stay calm and hardly react emotionally, rationally explaining what needs to be done next to fix the situation."
japan,355,"Imagine you are browsing the workshop offerings at a community center in Japan, and you see an experimental fusion of traditional tea ceremony and modern digital art. How inclined would you be to participate, and what draws you to or away from this experience?",Openness to Experience,I am extremely curious about the fusion of traditional and modern art forms and would love to see how the two worlds blend into new experiences.,"I am quite interested as the combination sounds intriguing, and I'd like to see how it enhances my understanding of both cultures.","I think it would be interesting to see once, mostly out of curiosity about how the elements are integrated.","I might consider it if I have time, but I prefer my tea ceremony and digital art experiences to be separate.","I am not very interested in mixing traditional ceremonies with digital elements, as I prefer each to be appreciated in its own distinct form."
japan,356,"Assume you're interested in joining a calligraphy class at the community center, but it overlaps with your usual routine of volunteering weekly. How would you organize your schedule to accommodate both activities, and what strategies do you use to maintain balance?",Conscientiousness,"I would meticulously plan my week in advance, ensuring both activities have dedicated time, and utilize time management tools to ensure none of my commitments suffer.",I'd adjust my volunteer schedule slightly to fit in the calligraphy class and keep a journal to track my commitments and ensure they're balanced.,"I'd try to fit both activities into my schedule where possible, being flexible with both commitments as needed to maintain a balance.","I might attend the calligraphy class occasionally and volunteer most weeks, adjusting based on how I feel at the time.","I would prioritize one activity and attend the other when convenient, without specific planning."
japan,357,"Imagine you are attending a popular cultural exchange workshop where you'll interact with people from diverse backgrounds. How do you feel about engaging with a group of strangers, and what role do you see yourself taking during group activities?",Extraversion,"I am excited to meet new people and see myself taking the lead in activities, facilitating conversation and ensuring everyone is involved.","I look forward to engaging with new people, and I expect to take an active role in encouraging group interaction.",I am interested in participating and anticipate contributing to the group activities in various ways.,I feel a bit unsure about meeting new people and plan to be a supportive participant rather than a leader in group activities.,I feel uncomfortable engaging with strangers and prefer to observe rather than actively participate.
japan,358,"Suppose you are in a situation where a fellow coding workshop participant struggles to understand a concept, yet the class must move on. How do you respond to the individual's need for help, and how do you balance that with the group's overall progress?",Agreeableness,I offer to stay after the workshop to help the participant understand the concept completely and assure them that they can ask me questions anytime.,"I suggest setting up a time during the break or after the session to go over the concept with the participant, so they don't fall behind.",I briefly explain the concept again to the participant during class and offer to help a bit more after the session if needed.,"I suggest they focus on asking questions during the class, and I might help later if there's time.","I advise them to look it up online later, as it's important for the class to keep moving."
japan,359,"Picture yourself signing up for a pottery workshop, only to discover that you are not immediately good at it, unlike other participants. How do you emotionally handle your initial lack of skill, and what do you do to cope with any stress or frustration?",Neuroticism,"I feel very anxious and frustrated, worrying excessively about my inability, and I keep thinking about giving up.","I feel upset and stressed about my lack of skill, but I try to channel my frustration into practicing more.","I acknowledge my disappointment but remind myself that initial struggles are part of learning, and I continue attending the class.","I feel only slightly uneasy, recognizing that not everyone starts out skilled, and I try to enjoy the process.","I stay calm and take it as a fun challenge, seeing it as an opportunity to learn without any concern about my current skill level."
japan,360,"Imagine you are responsible for setting up your class's booth at a Japanese school festival. You have the option to stick with a traditional design or experiment with a new, innovative layout. How would you approach the setup?",Openness to Experience,I would research cutting-edge designs and incorporate technology to create an interactive and unique booth experience.,I would bring in some innovative elements while still paying homage to traditional aspects to balance modernity and tradition.,"I would consider a few small updates to the traditional design to refresh its appeal, but mostly keep it conventional.",I prefer to stick with the traditional design but might add a minor upgrade for a slight change.,"I would strictly adhere to the traditional design without any changes, as it has always proven successful."
japan,361,Assume you are in charge of organizing the timeline for your group's presentation at the school festival. How would you ensure that everything is prepared and runs smoothly on the day of the event?,Conscientiousness,"I will create a detailed schedule, assign specific tasks to each member, hold regular check-ins, and have contingency plans for potential issues.","I will outline a timeline, delegate tasks to members, and monitor progress with some flexibility for changes.","I will draft a basic timeline, discuss it with the group, and periodically check that we are on track before the event.","I will make a general plan early on and remind the group before the event to prepare, but may not stick strictly to the schedule.","I will rely on the group to manage their parts, providing only a loose schedule and dealing with issues as they arise."
japan,362,Imagine you are given the task to be the spokesperson for your group during the festival. How would you feel about interacting with the audience and answering their questions about your project?,Extraversion,I would feel extremely excited and energized to engage with the audience and share all the details about our project.,I would be enthusiastic about interacting with people and feel confident in answering their questions.,I would feel comfortable talking to the audience and willing to answer their questions to the best of my ability.,I might feel a bit nervous but would be prepared to interact and handle questions as needed.,I would likely feel quite anxious and prefer to have limited interaction with the audience.
japan,363,Assume one of your teammates has a last-minute idea for improving the presentation. How would you respond to their suggestion considering the amount of work already completed?,Agreeableness,"I would fully support their idea and collaborate with the team to integrate it, even if it requires significant changes at this stage.","I would encourage them to share the idea and work with the team to incorporate it if possible, acknowledging that it could enhance our presentation.","I would listen to the suggestion and consider its feasibility, weighing the potential benefits against the time and effort involved.",I would suggest evaluating if the new idea can be implemented without disrupting the existing framework too much.,I would thank them for their suggestion but prioritize sticking to the current plan to ensure we meet the deadline.
japan,364,Imagine the projector fails during your presentation at the school festival. How would you handle the situation and manage your stress levels in front of the audience and your classmates?,Neuroticism,I would feel very anxious and struggle to focus as my mind races through all the worst-case scenarios.,I would feel quite nervous and take a moment to gather my thoughts before proceeding without the projector.,"I would feel a bit stressed but try to stay calm, reminding myself that I can adapt and continue with my presentation.","I would feel slightly concerned but maintain control, using it as an opportunity to engage the audience more directly.","I would remain calm, seeing it as a minor inconvenience and proceed with alternative ways to present my ideas."
japan,365,"Imagine you are a retired individual in Japan returning to university to study Japanese history. Would you prefer to stick to traditional lectures and textbooks, or seek out new and diverse ways such as participating in historical reenactments or using virtual reality experiences?",Openness to Experience,I am very excited to participate in historical reenactments and try virtual reality experiences to deeply engage with Japanese history in innovative ways.,I would enjoy mixing traditional lectures with some new methods like virtual experiences to have a diverse learning experience.,I am open to trying a balance of both traditional lectures and occasional new experiences if it enhances my understanding.,I prefer traditional lectures but wouldn't mind trying something new occasionally if it seems especially interesting.,"I would rather stick to traditional lectures and textbooks, as they provide a structured and familiar approach to learning."
japan,366,Assume you are starting a senior course in literature. How would you organize your study schedule to balance the academic workload with your other hobbies and commitments?,Conscientiousness,"I would create a detailed timetable breaking down my daily tasks, set priorities, and review my progress weekly to ensure all commitments are met efficiently.","I'd set aside specific hours each day for study and plan my hobbies around these periods, ensuring some flexibility for unexpected changes.","I would make a general weekly plan to allocate sufficient time to both study and other activities, adjusting as needed.","I'd study when I have time, trying to fit it around my existing commitments and ensuring I cover the essential topics.","I would study whenever it feels right, balancing it naturally with my hobbies without a strict schedule."
japan,367,Imagine you are attending a welcome event for part-time students at a Japanese university. How would you approach this event in terms of interacting with fellow students and professors?,Extraversion,"I would enthusiastically introduce myself to as many people as possible, starting conversations and exchanging contact information.",I would join in group conversations and make an effort to meet a good number of people while sharing about myself.,"I would participate in conversations, trying to talk with a few new people when opportunities arise.","I would stick to small groups, engaging in a few quiet conversations with those nearby.","I would likely keep to myself, observing the event without actively seeking conversation."
japan,368,"Suppose you have joined a study group with other senior students at the university. If a disagreement arises about the direction of a group project, how would you handle the situation to ensure harmony and collaboration within the group?",Agreeableness,I would listen to everyone's viewpoints and propose a solution that incorporates everyone's ideas to find a consensus.,"I would suggest a quick meeting for all group members to express their thoughts, aiming to blend the best suggestions for a group decision.",I would share my opinion and encourage an open discussion to weigh the pros and cons of each idea before deciding.,I would express my point of view strongly while being open to minor adjustments if necessary.,"I would firmly advocate for my own opinion, emphasizing its importance, and consider leaving the decision as it is if not agreed upon."
japan,369,"Imagine you are working on a challenging senior course project that seems overwhelming. How do you respond to the pressure, and what steps do you take to manage any stress or anxiety that arises?",Neuroticism,"I feel overwhelmed to the point of frequent panic attacks, so I take frequent breaks and consult a therapist to manage my stress.","I often feel anxious and may struggle to sleep, so I rely on mindfulness exercises and talking to friends to cope.",I experience some stress but manage it with a mix of planning and occasional relaxation techniques to stay focused.,I sometimes feel the pressure but try to stay calm by sticking to a schedule and addressing tasks one by one.,"I rarely get stressed and stay calm by trusting my ability to handle the work, approaching tasks systematically."
japan,370,"Imagine you are a parent attending a seminar about innovative educational tools in Japan. How would you react if the speaker introduces a new, unconventional method for enhancing children's creativity and problem-solving skills in the classroom?",Openness to Experience,"I would be extremely excited and eager to incorporate this method at home, while also discussing it with other parents to explore its full potential.",I would be quite interested and consider discussing with the teachers to understand how it can be integrated into my child's learning.,I would be curious but would want to see some evidence of its effectiveness before fully supporting the idea.,I would be a bit skeptical and would need more information before feeling comfortable about it being used widely.,"I would remain cautious, preferring traditional methods until there is substantial proof of its benefits."
japan,371,"Assume you are in the position of organizing notes from a recent school meeting for parents, detailing plans for upcoming academic events. How would you ensure that you keep track of important information and follow up on any key tasks?",Conscientiousness,"I would create a detailed, color-coded spreadsheet to categorize information, set reminders for deadlines, and regularly update all stakeholders through email summaries.","I would organize the notes into a clear document, assign deadlines to tasks, and check-in weekly with everyone involved to ensure progress.","I would summarize the crucial points in a document and highlight the main tasks, occasionally reviewing them to stay updated.","I would jot down key points in a notepad and refer to them when needed, occasionally following up as necessary.",I would try to remember the main tasks and make a mental note to check back if I have questions.
japan,372,"Consider that you are attending a parents' school meeting in Japan, where many parents are asking questions and sharing experiences. How do you typically respond in such a setting when opportunities arise to network and exchange ideas with others?",Extraversion,"I eagerly engage with multiple parents, asking questions and sharing my own experiences to build connections.","I interact with several parents, contributing my thoughts and listening attentively to their stories.","I chat with a few parents around me when there's a chance, sharing some relevant insights.","I listen mostly, offering my opinion occasionally when directly asked by others.","I remain attentive but prefer to observe, allowing others to take the lead in discussions."
japan,373,"Imagine you attend a seminar on strategies to support children's development, and another parent expresses a concern you disagree with. How would you handle the situation while maintaining a positive and cooperative atmosphere during the discussion?",Agreeableness,"I would listen carefully to their point of view, express my understanding, and find areas where we might align before gently sharing my perspective.","I would acknowledge their concern, express some agreement with parts of their view, and then share my opinion in a constructive way.","I would listen to their concern, then share my thoughts on the matter while trying to keep the discussion respectful.",I might briefly mention that I see things differently and suggest we look at the issue from another perspective without going into much detail.,I would simply state that I don't agree with their point and prefer not to discuss it further at the moment.
japan,374,Assume you are in a school meeting where the teacher outlines several areas where your child could improve. How do you manage feelings of stress or worry that may arise from hearing such feedback about your child's academic performance?,Neuroticism,"I feel overwhelmed and constantly worry about my child's future, often revisiting the teacher's words in my mind.","I feel quite stressed and think about the feedback frequently, but I try to stay positive and focus on finding solutions.",I feel concerned but try to consider the feedback as an opportunity for growth and discuss it rationally with my child.,"I have some worries, but I prefer to focus on the positive aspects and develop a plan to address the areas of improvement.","I take the feedback in stride, recognizing it's part of a learning process, and focus on supporting my child calmly."
japan,375,Imagine you are a university student in Japan considering an internship with a company that offers the chance to innovate new technologies. How excited are you about the opportunity to explore creative solutions to real-world problems?,Openness to Experience,I am extremely excited and can't wait to immerse myself in developing groundbreaking technologies that can make a significant impact.,I am quite eager to participate in novel projects and look forward to contributing unique solutions.,I am interested in the experience and see it as a good opportunity to learn and develop my skills.,"I am somewhat curious, but I prefer sticking to more traditional approaches.",I'm not very interested as I'd rather focus on tried-and-true methodologies.
japan,376,Assume you are in the position of managing both your academic studies and an internship. How would you prioritize and organize your time to ensure success in both areas?,Conscientiousness,"I create a detailed daily schedule, set clear goals, and review my progress weekly to ensure I am excelling in both areas.","I use a planner to prioritize my tasks, ensuring I allocate sufficient time to both my studies and internship responsibilities.",I balance my time by focusing on deadlines and try to work on what's most urgent without a detailed plan.,"I mainly respond to the needs of each day, addressing tasks as they come up without a strict schedule.","I handle things spontaneously and see how it goes each day, focusing more on whichever demands my attention most at the moment."
