country,question_id,question,trait,high,moderately_high,medium,moderately_low,low
japan,248,Suppose a potential client expresses concerns about your product's compatibility with their needs. How empathetically do you listen and respond to their concerns while maintaining a collaborative atmosphere?,Agreeableness,"I deeply listen to every concern, reassuring them that their needs are my priority and express my commitment to finding a tailored solution together.","I attentively acknowledge their concerns, discussing potential solutions and ensuring them that I value their needs in our collaboration.","I listen to their concerns, offer some suggestions to address them, and ensure their needs are considered in our discussion.","I listen to their concerns and suggest standard solutions, but I'm focused more on our product's typical benefits rather than customizing completely.",I acknowledge their concerns briefly and assure them that the product generally meets requirements but focus more on closing the deal.
japan,249,"Imagine a client interaction doesn't go as planned, and you are feeling anxious about the outcome. How do you manage your stress and emotions in such a high-pressure sales environment?",Neuroticism,"I tend to overthink everything and constantly worry about the repercussions, which makes it hard to concentrate on the next steps.","I feel quite anxious and find it challenging to focus, so I talk to a colleague to brainstorm solutions and calm myself.",I feel some stress but try to analyze the situation rationally and plan the next steps without getting overly emotional.,"I focus on what I can learn from the experience and move on without getting too stressed, dealing with emotions quietly.","I stay calm and composed, accepting that these situations happen and thinking practically about how to improve my approach."
japan,250,"Imagine you are participating in a community cleaning event in a park in Tokyo. You notice a group of people discussing new methods to make the cleanup more efficient. Do you join them, and if so, how open are you to exploring and trying out these innovative ideas?",Openness to Experience,"Absolutely, I'd be eager to not only join them but also contribute my own ideas and fully embrace any innovative approaches they suggest.",I would join the discussion and be interested in trying out some of their ideas to see how they might improve our efforts.,"I might listen in and try out a few of the ideas if they seem practical, but would mostly stick to familiar methods.",I would listen to their suggestions but might prefer to continue with the methods I already know and trust.,"I would likely keep to myself and follow my usual routine, as I'm comfortable with the current methods we are using."
japan,251,Assume you are in charge of organizing a section of the community cleaning event. How do you ensure the area is thoroughly cleaned and that all participants are equipped with the necessary tools to complete their tasks effectively?,Conscientiousness,"I create a detailed plan including a checklist of tasks, ensure all tools are available, assign clear roles to participants, and follow up with regular check-ins to ensure everything is on track.","I prepare a list of tasks, ensure basic tools are available, and assign roles while checking in periodically to see if anyone needs help.","I make a rough plan of action, gather tools needed, and generally monitor the area to address any issues that come up.","I trust participants to bring their own tools and do their part, and I stay available if any significant issue arises.",I assume participants will manage their tasks and tools independently and I am there mainly if any major problems occur.
japan,252,"Imagine you are at a bustling community cleanup event in one of Tokyo’s city streets. Do you find yourself energizing the group with your enthusiasm and chatting with as many people as possible, or do you prefer to focus quietly on your task?",Extraversion,"I thrive in such environments, enthusiastically coordinating activities and chatting with everyone I meet.",I enjoy engaging with people and often lead small groups with a cheerful attitude.,I'm comfortable interacting with a few people while ensuring my tasks are done efficiently.,"I prefer to focus on my cleanup task, though I don't mind the occasional brief chat with a fellow volunteer.",I like to work quietly and concentrate on my task without much social interaction.
japan,253,"During the community cleanup, you notice someone struggling to carry a large bag of litter. How do you respond to their need for assistance, and how does this reflect your approach to cooperative teamwork?",Agreeableness,I immediately offer a helping hand and encourage us to work together for the rest of the cleanup to make it easier for both of us.,I offer to help with carrying the bag and suggest we coordinate better to handle such tasks efficiently.,"I ask if they need help and assist if they agree, appreciating the effort of teamwork.","I hesitate but eventually step in to help, as I recognize the need to contribute to the group's effort.","I assume they can manage and continue with my task, thinking everyone has their responsibilities."
japan,254,"While participating in the event, you accidentally spill some trash, creating a minor mess. How do you handle the situation, and do you find yourself dwelling on this mistake or moving past it easily?",Neuroticism,"I feel very embarrassed and think about it for the rest of the day, worrying about what others might have thought.","I feel uneasy and clean it up immediately, finding myself thinking about it from time to time.","I apologize to those around, clean it up, and it only crosses my mind occasionally.","I apologize and clean it up without much thought, moving on with the event.","I don’t dwell on it at all, quickly cleaning it up and continuing to enjoy the event."
japan,255,"Imagine you are participating in the cleaning time at a Japanese school, and you find an artistic mural partially hidden behind an old board in the classroom. How do you react to this unexpected discovery?",Openness to Experience,"I feel an intense curiosity and excitement about the mural's history and meaning, and I decide to organize a project to restore and study it.",I am quite intrigued by the mural and plan to ask the teachers or students if they know more about its history.,I appreciate the mural's aesthetics and take a moment to admire it before continuing with the cleaning.,"I notice the mural but feel it is unrelated to the task at hand, so I continue with the cleaning.","I barely glance at the mural, considering it an obstruction to finishing the cleaning quickly."
japan,256,Assume you are in charge of organizing a team of students during cleaning time. You notice that the cleaning supplies are running low and some areas are not as clean as they should be. What steps do you take to ensure everything is cleaned properly before the end of the day?,Conscientiousness,"I make an inventory of current supplies, redistribute what we have efficiently, contact the staff to request additional items, and assign students to check each area for thoroughness.","I quickly assess which areas need more attention, rotate the cleaning supplies we have, and emphasize teamwork to cover the essential spots effectively.",I instruct the team to focus on the most critical areas for cleaning and ensure we make the best use of what's left until restocking happens.,I suggest we do the best we can with the supplies available and tell students to clean where they feel it's most needed.,"I tell the team to use up the remaining supplies and clean until they run out, then wrap up for the day."
japan,257,"Imagine during cleaning time, you and your classmates are all tasked with tidying up a very large hall. How do you engage with your peers while working together to complete the task efficiently?",Extraversion,"I actively organize the group, encourage everyone, and keep the mood lively with stories and jokes.","I chat with different groups, sharing ideas and making sure everyone is on track without losing focus.","I discuss our roles and timing with a few peers, helping out as needed and occasionally joining conversations.","I work quietly, speak to people nearby only when necessary, and focus mostly on my own tasks.","I concentrate on my work alone, minimizing interaction unless directly asked something."
japan,258,Assume you are cleaning with a classmate who seems unwilling to participate and prefers to chat instead. How do you handle the situation to keep the atmosphere positive and still get the work done?,Agreeableness,"I warmly invite them to join me and suggest that we chat while cleaning, making it a fun group activity.",I gently remind them of the task and propose we can chat once we've finished cleaning together.,"I comment that the work will go faster if we both pitch in, and suggest dividing the tasks.",I focus on my own tasks and hope they'll notice and start helping on their own.,"I decide to let them chat and complete the cleaning myself, knowing I'll be more efficient alone."
japan,259,"Imagine you notice a group of students carelessly leaving trash on the floor while cleaning time is ending, causing you to feel stressed about the increased mess. How do you handle your feelings and the situation?",Neuroticism,"I feel extremely anxious and immediately confront the students to address the issue, urging them to clean up the mess.",I feel stressed and politely ask the students if they can help pick up the trash before it becomes a bigger problem.,"I notice the mess and feel a bit stressed, but decide to pick it up myself while calmly reminding the students next time.",I feel slightly annoyed by the situation but mention to the students that we should all work together to finish cleaning up.,I feel unfazed by the mess and quietly clean it up myself without addressing the students.
japan,260,"Imagine you are at a Japanese train station where the staff keeps everything spotless. How open would you be to exploring a hidden, traditional tea shop nearby that offers a unique tea-tasting experience?",Openness to Experience,I am very eager to explore the tea shop and try all the unique teas they have to offer.,I would definitely like to visit and sample a few of the unique teas they serve.,It sounds interesting; I might check it out if I have the time.,"I am curious, but I might just stick with what I'm familiar with unless persuaded otherwise.",I'd rather not; I'll stick to familiar places and experiences.
japan,261,Assume you are responsible for maintaining the cleanliness of a Japanese train station. How would you ensure that no detail is overlooked in maintaining cleanliness and order?,Conscientiousness,"I would create a detailed cleaning schedule, conduct regular inspections, and ensure that all staff are trained to follow precise procedures for every part of the station.",I would establish a checklist for daily cleaning tasks and periodically review it to ensure all areas are consistently maintained.,I would maintain regular cleaning routines and address any specific concerns as they arise during daily operations.,I would focus on key areas that receive the most traffic and ensure they are cleaned regularly.,I would clean when it seems necessary or when there are complaints of untidiness.
japan,262,Imagine you are waiting for your train at a Japanese station. How inclined are you to strike up a conversation with fellow commuters about the importance of cleanliness in such public spaces?,Extraversion,"I would eagerly start a conversation with someone nearby, perhaps sharing some stories about clean stations I've encountered.","I would likely comment to a fellow commuter about how well-maintained the station is, expecting a short but pleasant exchange.","I might strike up a conversation if someone else mentions cleanliness, otherwise, I’d remain mostly to myself.","I would probably just give a friendly nod or smile when noticing others appreciating the cleanliness, keeping to myself.","I prefer to keep to myself and not initiate conversations with fellow commuters, focusing on my own thoughts or activities."
japan,263,"While standing on a platform, you notice a staff member struggling with a large cleaning cart. How would you respond to ensure everything runs smoothly?",Agreeableness,I would immediately offer to help push the cart and organize the items to make it easier for them.,I would ask the staff member if they needed assistance and help if they agree.,I would watch briefly to see if they manage on their own and step in if it looks like it's needed.,I would consider helping but decide to let another staff member handle it instead.,"I would continue waiting on the platform, assuming the staff will handle it themselves."
japan,264,"Imagine you are in a bustling Japanese train station, and your journey is delayed. How would you react internally and externally to this unexpected situation while maintaining your composure?",Neuroticism,"I would feel extremely frustrated and anxious, constantly checking the time and worrying about the consequences of being late.","I would feel quite uneasy and keep thinking about how this delay might affect my plans, but I try to calm myself with a deep breath.","I would acknowledge the inconvenience and feel a bit stressed, but I decide to focus on staying calm and distracting myself with my phone.",I feel slightly concerned but reassure myself that everything will work out; I look for updates and relax by observing my surroundings.,"I remain calm, accepting that delays are inevitable, and choose to use the time to enjoy a book or listen to music."
japan,265,Imagine you are attending a Japanese festival and a local suggests an alternative cleanup method that you've never heard of before. How do you respond to this new idea?,Openness to Experience,"I'm very curious! Please show me how it works, I'd love to learn more.",That sounds interesting! I'm open to trying something new.,"I'm a bit skeptical, but I'm willing to give it a try.","I appreciate the suggestion, but I prefer sticking to the method I'm familiar with.",I'm not interested in trying a new method; I'll stick to what I know.
japan,266,Assume you are in charge of organizing the festival's cleanup efforts. How do you ensure every detail is covered and the area is restored properly?,Conscientiousness,"I create a detailed cleanup plan, assign specific tasks to team members, and conduct multiple checks to ensure everything is spotless.","I develop a thorough checklist and allocate tasks to each team member, following up to make sure everything is in order.","I make a checklist and assign tasks, trusting the team to handle them and doing a final walkthrough.","I give general instructions to the team and do a quick check in the end, handling any obvious issues myself.",I rely on the team to manage the cleanup and only step in if something major comes up.
japan,267,"Imagine you are part of a team involved in cleaning up after a festival in Japan. Do you take the opportunity to engage with others, or do you prefer to focus on the task quietly?",Extraversion,"I enthusiastically engage with everyone, sharing stories about the festival and making new friends.",I enjoy chatting with a few people around me while we work together on the cleanup.,I participate in some conversations but mostly focus on the task at hand.,"I spend most of my time focused on cleaning, occasionally joining in when spoken to.","I prefer to work quietly on my own, keeping to myself during the cleanup."
japan,268,Assume you notice another participant struggling with their cleanup duties. How do you approach the situation?,Agreeableness,I immediately offer to help them finish the cleanup and make sure they’re not overwhelmed.,I ask them if they need help and assist them with some tasks if they agree.,I observe them for a bit and lend a hand if it seems like they need help.,I wait to see if they ask for help before stepping in.,I assume they can manage and continue with my own tasks.
japan,269,"Imagine you are cleaning up after the festival, and you start feeling overwhelmed by the amount of work left. How do you handle your emotions in this situation?",Neuroticism,"I feel very stressed and anxious, constantly worrying if I will finish everything on time, and it's hard for me to calm down.","I feel quite stressed, but I try to keep going while feeling nervous about the possibility of not completing the tasks.","I notice some stress building up, but I focus on taking one step at a time without letting it affect me too much.","I feel a little overwhelmed, but I'm able to brush it off and focus on finishing the task at hand.",I don't get overwhelmed easily; I stay calm and keep a steady pace until the work is done.
japan,270,"Imagine you are visiting a traditional Japanese household, and you're asked to choose from a selection of unique, artistically decorated indoor slippers. How do you react to the opportunity to wear something different and experience a new cultural tradition?",Openness to Experience,I am thrilled and can't wait to see which unique design I'll get to wear; each choice is an exciting new experience.,"I'm quite intrigued and eager to try one on, perhaps even discuss the designs with the host.","I'm open to wearing one of the slippers, appreciating the cultural experience it provides.","I will choose a pair to wear, but I prefer something that appears more familiar and comfortable to me.","I feel more comfortable sticking with my own shoes, but I respect the tradition."
japan,271,Assume you are in the position of hosting a gathering at your home in Japan. How do you ensure that guests follow the tradition of removing shoes and using indoor slippers to keep your living space tidy?,Conscientiousness,"I meticulously prepare by setting up a visible sign and neatly arrange a variety of slippers at the entrance, personally guiding each guest with a friendly reminder.",I make sure to have enough slippers ready at the door and gently remind guests to switch upon arriving.,"I provide slippers by the entrance and assume guests are familiar with the custom, mentioning it casually if needed.","I lay out some slippers near the doorway and hope guests notice, only reminding them if I see shoes left on.","I leave things as they are, letting guests decide if they want to follow the custom of removing shoes."
japan,272,"Imagine you arrive at a Japanese friend’s house party, and you're the first one there. How do you handle the situation of being greeted warmly and instructed about the shoe etiquette before other guests arrive?",Extraversion,"I warmly thank my host, actively engage in conversation, and explore the house setup, eager to contribute to the lively ambiance.","I express my gratitude for the instructions, engage in friendly chat with the host, and share my excitement for the party.","I politely acknowledge the instructions, make some small talk with the host, and wait comfortably for others to arrive.","I thank the host for the instructions, make brief eye contact, and then choose a quiet spot to wait silently.","I quietly nod to acknowledge the shoe etiquette, avoid lengthy interactions, and find a corner to sit silently until more guests arrive."
japan,273,"Assume you are staying at a Japanese inn and by mistake, another guest takes your slippers. How do you address this situation with the inn staff or the other guest, while maintaining harmony and politeness?",Agreeableness,"I would kindly approach the staff to explain the mix-up and ask them to help resolve it, ensuring the guest feels completely comfortable.",I would gently inform the staff about the mix-up and suggest a polite way to let the guest know about the mistake.,"I would speak to the staff about the situation, hoping they handle it discreetly with the guest.","I would mention the issue to the staff, expecting them to address it, but wouldn't insist too strongly on a resolution.","I might just mention it briefly to the staff and leave it to them to deal with it, without worrying much about the outcome."
japan,274,Imagine you enter a Japanese home and you accidentally wear the wrong size slippers that are uncomfortable. How do you manage your discomfort and any anxiety about asking for a more suitable pair?,Neuroticism,I feel quite anxious about saying anything and decide to try to endure the discomfort as long as possible without speaking up.,"I hesitate for a while, feeling a bit anxious, but eventually gather the courage to politely ask if there is a different size available.",I feel slightly uncomfortable but calmly mention the issue to the host and ask if I could switch to a more comfortable pair.,I barely feel any anxiety about it and simply ask the host if there might be a different pair I could use.,I casually mention the slipper size and ask for another pair without any worry or hesitation.
japan,275,Imagine you are encouraged to redesign your office space to enhance creativity while tidying up. How would you approach the task to incorporate both creativity and neatness into your environment?,Openness to Experience,"I would explore various design philosophies, incorporate a mix of colors, and use unconventional furniture while ensuring everything has a designated, organized space.","I would introduce some vibrant colors and artwork to inspire creativity, while keeping the desk and shelves neatly arranged.",I would rearrange the furniture for better flow and add a few creative elements while maintaining organization in most areas.,"I would consider a few small changes to enhance creativity, like a new painting or plant, but keep the layout mostly the same for order.","I would prefer to keep the office as it is, focusing on maintaining neatness without any major changes to the creative aspects."
japan,276,Assume you are responsible for maintaining cleanliness in your shared office area. How do you ensure that the space stays organized on a daily basis without disrupting your regular work schedule?,Conscientiousness,"I create and adhere to a detailed cleaning and organizing schedule, ensuring each task is done efficiently and on time.","I make sure to tidy up the office at the end of each day, following an informal checklist to cover all necessary tasks.",I clean up when necessary and make a point to organize my workspace every few days to maintain order.,I do a quick clean-up if there's a noticeable mess or when reminded by colleagues.,I clean and organize the office space only when it becomes too cluttered to work effectively.
japan,277,Picture yourself leading a group tidying session with your colleagues. How do you engage with your team to make the experience more enjoyable and collaborative?,Extraversion,"I enthusiastically encourage everyone to share their ideas and create a fun, energetic atmosphere with jokes and music.",I actively stimulate conversation and occasionally ask for suggestions to keep everyone involved and motivated.,"I keep the session focused and organized, checking in with my colleagues to see how they’re doing from time to time.","I run the session efficiently, making suggestions when necessary and recognizing the efforts quietly.","I give necessary instructions at the start and let everyone work independently, only speaking when questions arise."
japan,278,"Imagine a co-worker consistently leaves their desk untidy, affecting the shared space. How would you address this issue while maintaining a harmonious office atmosphere?",Agreeableness,I would kindly offer to help tidy the shared space together and suggest we keep it clean to foster a pleasant work environment.,I would gently mention the mess and propose some simple ways we can both keep the space organized.,I would bring up the issue in a friendly way and ask if we could find a mutual solution to keep the area tidy.,"I would inform them about the issue, suggesting they be more careful about keeping the space neat.",I would directly address the untidiness and ask them to clean up their part of the area.
japan,279,Suppose you feel overwhelmed by the disorganized state of your desk. How do you manage your stress and emotions while bringing your work area back to order?,Neuroticism,"I find myself feeling very anxious, and I take frequent breaks to try to calm myself, but it's hard to concentrate until everything is perfectly organized.","I feel quite stressed and need to sit quietly and breathe deeply before starting to tidy up, taking it one step at a time.","I notice some stress, but I make a list of things to organize, which helps me address the mess in a calm manner.","I feel a little uneasy, but I just start tidying up one thing at a time until it looks better.","I don't feel much stress and just tidy up my desk as needed, knowing it's not a big deal."
japan,280,"Imagine you are dining in a traditional Japanese restaurant, and the server suggests trying a dish you've never heard of before. How do you respond to this opportunity to try something new?",Openness to Experience,"Absolutely, I’d love to try it! I’m always excited to discover new dishes.","Sure, I’m open to trying it. New experiences are always interesting.",I might as well give it a try; I’m curious.,"I’m a bit hesitant, but maybe I’ll try a small portion.","I think I’ll stick with the dishes I’m familiar with, maybe next time."
