country,question_id,question,trait,high,moderately_high,medium,moderately_low,low
brazil,255,Imagine you are tasked with brainstorming creative ideas for the virtual fundraiser's Instagram posts to engage the community. How would you approach this task?,Openness to Experience,"I would explore unconventional themes and incorporate interactive elements, like polls or challenges inspired by Brazil's diverse cultural festivals, to engage followers actively.",I would focus on unique visuals and engaging captions that draw inspiration from Brazil's vibrant art and music scenes to captivate the audience.,I would research trending topics and include some locally relevant elements to create appealing and engaging content.,I would use proven templates and adjust them slightly to fit the theme of the fundraiser.,I'd stick to a conventional style by updating regular posts and announcements as done previously.
brazil,256,Assume you are responsible for managing the schedule and ensuring all tasks for the virtual fundraiser are completed on time. How would you organize yourself to meet the deadlines?,Conscientiousness,"I would create a detailed timeline, set reminders for each task, prioritize based on urgency, and regularly review progress to adjust plans as needed.","I would list all tasks, prioritize them, and allocate specific times in my calendar to work on each one.",I would note down the main tasks and make sure to check my progress regularly to avoid falling behind.,"I would try to get an overview of tasks and work on them when I find the time, focusing on those that seem most urgent.","I would handle tasks as they come, addressing immediate requests first without a detailed plan."
brazil,257,Imagine you are given the chance to host a live session on Instagram to encourage donations and spread awareness about the fundraiser. How would you plan to interact with the online audience?,Extraversion,"I would enthusiastically engage with my audience throughout the session, respond to all comments, and share exciting stories and personal anecdotes to keep the energy high.","I would actively interact with my audience, encourage questions, and share insightful information about the campaign to maintain interest.","I would deliver a prepared speech, answer some key questions, and thank everyone for their support.",I would present the necessary details and maybe answer a few questions if time permits.,I would focus on delivering the main details and end the session without much interaction.
brazil,258,Assume one of your friends has a different idea about how to best allocate the funds raised. How would you address and incorporate their opinion into the fundraiser plan?,Agreeableness,"I would invite my friend to discuss their idea at length, fully consider it, and work collaboratively to incorporate it into the plan.",I would actively listen to my friend's perspective and try to find a way to integrate parts of their idea into our current plan.,I would consider my friend's opinion and decide which aspects could work well with our existing plan.,I would hear what my friend has to say and see if there are any small adjustments we could make to include their idea.,"I would acknowledge my friend's idea, but likely stick with the original plan unless there are major benefits in changing it."
brazil,259,"Imagine you are facing technical difficulties during a critical phase of the fundraiser, and you start feeling overwhelmed. How would you manage your stress and continue contributing effectively?",Neuroticism,"I would likely spiral into worry, staying focused but constantly anxious about the potential negative outcomes.",I would feel quite stressed but try my best to manage my anxiety by taking deep breaths and focusing on solutions.,I would feel a bit tense but remind myself that these issues are manageable and focus on resolving them step by step.,"I might initially feel a bit stressed but would soon calm myself, knowing things can be worked out by asking for help if needed.","I would remain calm, confident that we can handle any issues as a team without getting overly stressed."
brazil,260,"Imagine you are João, a university student in Salvador who finds out about a new online tool that could enhance the tutoring sessions you volunteer for. How interested are you in exploring and possibly integrating this new tool into your approach?",Openness to Experience,I'm very excited to explore this new tool and look forward to integrating it into my sessions to see how it can benefit the students.,I'm quite interested in testing out the new tool and will likely incorporate it if it proves helpful.,"I think it could be useful, so I'll give it a try and see if it fits well with my current approach.","I'm somewhat hesitant, but I might look into it if others recommend it and it's not too complicated to use.",I'm not really interested in trying out the new tool as I'm comfortable with the current methods I'm using.
brazil,261,"Assume you are João, and you have just completed a series of tutoring sessions. Families are relying on your consistency, but you have a big exam tomorrow. How do you balance your study commitments with ensuring these families get the help they need?",Conscientiousness,"I will create a detailed schedule to effectively manage both commitments, ensuring I do not compromise on either tutoring or my study time.",I'll prioritize my biggest tutoring responsibilities today but will stay up late if needed to revise for the exam.,"I'll try to make time for both, albeit focusing slightly more on my exam preparation as it's important too.","I’ll focus on my exam primarily, fitting in tutoring where I can without straining myself too much.","My exam takes priority right now, so I'll skip tutoring sessions until it's done, apologizing to the families."
brazil,262,Imagine you're João attending a community event to promote the tutoring initiative. How do you approach engaging with new people at the event to spread awareness and recruit more volunteers?,Extraversion,"I enthusiastically introduce myself to everyone, share stories about our impactful work, and invite them to join our next meeting for potential volunteers.","I approach several groups, share key information about the initiative, and offer my contact details for follow-up discussions.","I interact with a few people, provide brochures about our tutoring activities, and suggest they check our website for more details.","I stay with familiar faces but listen to others discussing our initiative, occasionally offering a comment or two.","I keep to myself mostly, observing the event from a distance and noting any potential volunteers to reach out to later in writing."
brazil,263,"Assume you're João and a family you regularly help is facing a difficult situation, asking for additional support that stretches beyond your usual commitments. How would you respond to their request while considering your own boundaries and available time?",Agreeableness,"I would rearrange my schedule entirely and prioritize helping them, providing as much extra support as they need.","I’d adjust my plans to assist them more than usual, ensuring I still manage my own priorities.",I would evaluate how much more I can help and offer whatever extra support is manageable.,I’d let them know I can only provide a little extra help due to my own commitments.,I would express sympathy but explain that I'm unable to offer any more help beyond what I already do.
brazil,264,"Imagine you are João, and a session with a family did not go as planned, leaving you feeling anxious about the effectiveness of your tutoring. How do you deal with this stress and any negative feelings that arise from this experience?",Neuroticism,I feel overwhelmed by worry and can't stop thinking about what went wrong and how it might affect my reputation.,I feel quite concerned and spend a lot of time trying to analyze what could have been improved for next time.,"I am a bit worried, but I tell myself to learn from the experience and focus on the next opportunity.","I feel a little uneasy about it but remind myself that not every session will be perfect, and that's okay.","I don't let it bother me much and quickly move on, knowing these things happen and don’t define my abilities."
brazil,265,Imagine you are joining the Facebook group for the community garden in the favela. How would you propose introducing new and unique vegetables or cultivation techniques to the group?,Openness to Experience,I'd be excited to present a variety of rare vegetables from different cultures and suggest innovative hydroponic systems to explore.,I would enthusiastically share a couple of unusual vegetable varieties and some creative growing methods I've recently learned about.,I’d propose a few new vegetables and cultivation techniques that I think might suit our garden.,I might suggest one or two new vegetables while mainly encouraging techniques we are familiar with.,"I'd suggest keeping with the traditional plants and methods we're accustomed to, as they are reliable."
brazil,266,Assume you are responsible for scheduling the watering shifts for the garden. How would you ensure that everyone knows their responsibilities and everything runs smoothly?,Conscientiousness,"I would create a detailed schedule, communicate it via email and group chat, and hold a meeting to ensure everyone understands their tasks.",I would prepare a clear schedule and send reminders through a group chat to keep important details on hand.,"I'd set up a basic schedule and inform everyone through a message, asking them to confirm receipt.","I’d make a simple schedule and post it on a shared board, expecting everyone to check it themselves.",I’d verbally inform a few people about their shifts and assume word-of-mouth will cover the rest.
brazil,267,Imagine you are at the first in-person meeting of the garden group. How do you approach interacting with the other residents and encourage participation and enthusiasm?,Extraversion,"I enthusiastically greet everyone with a warm smile, start engaging conversations, and invite them to share their gardening tips and personal stories.",I introduce myself to a few people and suggest we brainstorm fun activities for the garden together.,I chat with the person next to me and ask general questions about their gardening experiences.,"I wait for others to initiate contact, and then join in the conversation if it looks interesting.",I stay in the background and focus on listening to what the more outgoing members have to say.
brazil,268,Assume that a disagreement has arisen in the Facebook group about the division of the produce. How do you mediate the situation to find a cooperative solution among the members?,Agreeableness,"I would actively listen to all perspectives, promote open communication, and ensure everyone feels heard before suggesting a compromise that satisfies everyone involved.","I would encourage everyone to share their views and work toward a solution that most members can agree on, trying to balance different opinions.",I would suggest taking turns to express concerns and try to identify a middle ground that addresses the main points of conflict.,"I would propose a solution that I think is fair and ask if everyone can agree, considering only the most prominent opinions.","I would outline a plan based on what seems most efficient, even if not everyone fully agrees, to resolve the disagreement quickly."
brazil,269,Imagine you are feeling overwhelmed by the challenges of maintaining the garden and the group's dynamics. How do you handle your stress and emotions in this situation?,Neuroticism,"I feel quite anxious and struggle to concentrate, often worrying about every detail.",I experience some stress but try to talk about it with a friend for reassurance.,"I recognize my stress but take it one step at a time, maybe taking short breaks when needed.",I usually manage stress by focusing on tasks outside the garden and stay calm.,I don't feel much stress and remain confident everything will work out fine.
brazil,270,"Imagine you are Ana, receiving a suggestion from a fellow educator in your Telegram channel to incorporate storytelling sessions with the books collected for the children. How do you respond to this new idea?",Openness to Experience,I love this idea! Let's explore different storytelling techniques and make it a weekly event for the kids.,That sounds interesting! Maybe we can start by trying it out a couple of times to see how the children respond.,I'm open to the idea but want to make sure we have the right resources to implement it effectively.,"It's not a bad idea, but I'm a bit concerned about fitting it into our current schedule.","I'm not sure this aligns with our current goals, so I think we should stick to our original plan for now."
brazil,271,"Assume you are in the position of scheduling the collection and distribution of school supplies, but the task requires meticulous planning and coordination. How do you approach organizing this effort efficiently?",Conscientiousness,"I create a detailed timeline, allocate specific tasks to team members, and constantly monitor progress to ensure everything stays on track.","I draft a comprehensive plan, assign responsibilities, and periodically check in with the team to address any issues.","I develop a basic schedule, ensure tasks are assigned, and make adjustments as needed throughout the process.",I outline a rough plan and rely on team coordination to work out most of the details along the way.,"I approach it with minimal planning, trusting that things will fall into place as we proceed."
brazil,272,"Imagine you are Ana, planning a weekend event for the educators involved in the book and supplies collection drive. How do you engage with your colleagues to ensure a lively and collaborative atmosphere?",Extraversion,"I organize exciting group activities and personally reach out to everyone, making sure everyone feels included and motivated.",I suggest a few fun interactive sessions and encourage team members to volunteer for leading parts of the event.,I coordinate the agenda and ask for input from the team to generate engagement in planning the event.,"I share the event details and wait for feedback or suggestions from the team, contributing when necessary.",I prefer to work on the logistics behind the scenes and let others take the lead in creating a lively atmosphere.
brazil,273,Assume you are faced with a disagreement among educators in the Telegram channel about the allocation of resources. How do you mediate to reach a peaceful and satisfactory resolution?,Agreeableness,"I actively listen to all concerns, validate their perspectives, and propose a compromise that maximizes satisfaction for everyone involved.",I encourage a discussion to understand everyone's needs and facilitate a mutually beneficial agreement through negotiation.,I suggest a meeting to hear out each side and propose a balanced solution that considers the main points raised.,"I listen to the main arguments and suggest a practical solution, even if it doesn't completely satisfy all parties.","I identify the most pressing issue and recommend a straightforward allocation, regardless of differing opinions."
brazil,274,"Imagine that unexpected challenges arise during the collection drive, leading to delays in getting supplies to the children. How do you handle your emotions and react to the stress of the situation?",Neuroticism,"I find myself overwhelmed with anxiety and inability to focus, worrying constantly about all the ways things could go wrong.","I feel quite stressed and nervous, but I attempt to manage my emotions by talking to a friend or colleague for reassurance.","I feel some stress but try to rationalize the situation and focus on finding solutions, taking breaks when necessary.","I remain relatively calm and focus on tackling the challenges one step at a time, believing that things will eventually work out.","I stay completely composed and unbothered, understanding that these kinds of issues are a normal part of any project."
brazil,275,"Imagine you are Carlos, and you have a novel idea to incorporate local cultural storytelling into the childcare sessions. How do you decide to approach the parents and caregivers with this idea, knowing it differs from their usual activities?",Openness to Experience,"I would enthusiastically present how storytelling can enrich children's experiences, and suggest trying it for a week to see its benefits firsthand.","I would discuss the idea with the parents, explaining its educational value, and propose incorporating it gradually into our sessions.",I would bring up the idea in conversation with parents to gauge their interest and see if they have any suggestions or concerns.,I would cautiously suggest a pilot session to see if it attracts interest before making any further commitments.,I would prefer to keep our usual activities but might consider creating a brief overview for those who are interested.
brazil,276,"Assume you are Carlos, responsible for coordinating the rotating caregiving schedule. How would you ensure that all caregivers are informed of their duties and commitments, keeping everyone organized and punctual?",Conscientiousness,"I would create a detailed spreadsheet with dates, times, and tasks for each person and send regular reminders via email and WhatsApp to ensure everyone is aligned.","I would draft a weekly schedule and send it through the team’s group chat, following up with each caregiver individually to confirm their understanding.",I would share the schedule at the start of each week and check in midweek to see if everyone is keeping track.,"I would post the schedule online and rely on caregivers to check it themselves, stepping in only if I notice any issues.",I would inform everyone of the upcoming week's schedule once and expect them to manage their own time.
brazil,277,Imagine you are Carlos attending a local community event to raise awareness about the shared childcare initiative. How do you interact with attendees to spread the word and gather support?,Extraversion,"I enthusiastically engage with everyone, forming small groups to discuss the initiative and encourage them to ask questions and share their thoughts.","I actively approach different groups of people, sharing information and listening to their feedback to generate enthusiasm and interest.","I chat with a few people individually, explaining the benefits and importance of the initiative when they seem interested.","I prefer to join ongoing conversations to talk about the initiative, adding my points when there’s an opportunity.","I stay near the information stand, providing materials when people ask and let them approach me with questions."
brazil,278,"Assume you are Carlos, and a family expresses dissatisfaction with their current caregiver. How would you handle the situation to maintain a harmonious and cooperative atmosphere among all families and caregivers involved?",Agreeableness,"I would actively listen to the family's concerns, apologize for the inconvenience, and collaborate with them and the caregiver to swiftly find a mutually agreeable solution.","I would approach the family to understand their concerns and work with the caregiver to make necessary adjustments, aiming to find a satisfactory resolution for everyone.","I would ask the family to share their concerns and explore possible improvements with the caregiver, seeking a balance that might work for both parties.",I would acknowledge the family's concerns and suggest that they communicate more directly with the caregiver to resolve the issue themselves.,I would tell the family that it's better for them to discuss their issues with the caregiver and let them handle it independently.
brazil,279,Imagine you are Carlos facing a day where several caregivers have unexpectedly canceled. How do you deal with the stress of finding replacements on short notice while keeping calm in front of the families relying on the service?,Neuroticism,"I feel extremely overwhelmed and anxious, struggle to breathe, and worry excessively about potential disruptions to families while scrambling to find someone available.","I experience significant stress and slight panic, making it difficult to concentrate, but I try to methodically reach out to replacements, even though I feel very tense.","I find myself moderately stressed, taking deep breaths to stay focused, and I start contacting potential caregivers while managing to keep a level head.","I feel a bit tense but manage to stay fairly calm, trust in my action plan, and update families regularly as I work through my list of backup caregivers.","I remain calm, use a pre-prepared list of contacts, and reassure families that everything is under control without feeling stressed."
brazil,280,Imagine you are the bartender facing many new opportunities in the vibrant city of Manaus. How do you approach exploring this unfamiliar environment and the diverse culture it offers?,Openness to Experience,"I eagerly dive into every cultural experience Manaus offers, from trying food at local markets to joining community festivals, eager to learn more about their traditions.","I actively seek out unique experiences, such as trying new foods and exploring local events, to understand the culture of Manaus better.","I try to visit some well-known attractions and sample local dishes, balancing exploration with familiar activities.","I focus on exploring a few familiar areas in Manaus, occasionally trying new experiences suggested by locals.","I prefer sticking to my usual routine and exploring only when necessary, avoiding unfamiliar cultural experiences."
brazil,281,Assume you are in the position of needing to manage your time efficiently while attending interviews and skill-building sessions from the job forum. How do you plan your day to ensure productivity?,Conscientiousness,I create a detailed schedule prioritizing tasks based on deadlines and allocate specific time slots for each activity.,"I make a to-do list with estimated times for each task, ensuring I focus on the most important ones first.",I plan a rough schedule to cover the main activities and adjust throughout the day as needed.,I prioritize tasks as they arise and try to attend to them without a strict plan.,"I handle tasks spontaneously without much planning, addressing issues as they come."
brazil,282,"Imagine you are the newly employed bartender in Manaus who wants to build strong relationships with customers and coworkers in your temporary job. You find yourself in a bustling online forum meetup organized by your friend. How do you position yourself to actively engage and stand out in the conversation, while building a rapport with everyone present?",Extraversion,"I start by enthusiastically introducing myself, sharing interesting stories and inviting others to chat privately afterwards.","I introduce myself with confidence, comment on several topics, and invite a few people for further discussions.","I greet everyone warmly, contribute occasionally to the topics discussed, and casually connect with a couple of participants.","I introduce myself briefly, listen to the conversation, and contribute when directly asked for my opinion.","I join the meeting quietly, observe the discussion, and participate only when necessary."
brazil,283,"Imagine you are offered a temporary job by a friend, but the pay is lower than expected, yet it helps them during a busy period. How do you react to their offer?",Agreeableness,I immediately accept the offer and think of it as a way to support my friend and be helpful.,"I accept the offer because I want to assist my friend, even though the pay isn't what I hoped for.",I consider the pros and cons and decide to help my friend despite the lower pay.,I express my concerns about the pay and accept it only because my friend really needs help.,I politely decline the offer due to the low pay but wish them well in finding help.
brazil,284,You've just received some rejection emails from job applications. How do you handle the stress and maintain your motivation to continue searching?,Neuroticism,"I feel overwhelmed and anxious, so I take a moment to acknowledge my feelings and try to find ways to manage my stress while reluctantly pushing myself to apply for more jobs.","I feel disappointed but I try to focus on self-care activities to reduce stress, and motivate myself to keep applying for new opportunities.","I feel a bit stressed but remind myself that rejection is a natural part of the process, and I continue applying after reflecting on possible improvements.",I feel slightly discouraged but quickly shake it off and start looking for more opportunities to apply to without dwelling too much on the rejections.,"I feel indifferent about the rejections and continue to apply for more jobs, maintaining a practical mindset without stressing over it."
brazil,285,"Imagine you are part of the messaging group in Minas Gerais and someone proposes a new, innovative way to use digital platforms to negotiate prices with pharmacies. How would you respond to this suggestion?",Openness to Experience,That's a fantastic idea! I'm really excited to explore how we can implement it and see the impact on our negotiations.,This seems like a promising approach. I'm keen to learn more details and see how it can be incorporated into our current processes.,"That sounds interesting, but I'd like to understand more about how it would work in practice.","I'm a bit uncertain about this new method, but I suppose we can give it a try with some guidance.",I'm not sure this is the right fit for us. I prefer sticking to our current methods for negotiating with pharmacies.
