country,question_id,question,trait,high,moderately_high,medium,moderately_low,low
brazil,348,Imagine a family member is trying to take over your task of securing the decorations and insists they have a better method. How would you handle this situation to maintain harmony during the wedding?,Agreeableness,"I would warmly thank them for their suggestion, encourage them to take the lead, and fully support their approach to ensure everything goes smoothly.","I would listen to their idea, discuss it openly, and try to integrate their method with mine to make them feel valued.","I would consider their suggestions and decide together if their method is feasible, aiming for a compromise that satisfies both parties.",I would acknowledge their point of view but express my intention to follow through with my original plan while making minor adjustments.,"I would let them know that I've planned everything carefully and prefer to handle it myself, assuring them that everything will be fine."
brazil,349,"Assume you’re responsible for an important aspect of the celebration, and the wind threatens to ruin it. How do you manage the stress and your emotions while dealing with this unexpected challenge?",Neuroticism,"I panic and feel overwhelmed, finding it hard to think clearly as I worry about everything going wrong.",I feel quite stressed and anxious but try to focus on finding a quick solution to minimize the damage.,I acknowledge my stress but try to stay calm and address the problem pragmatically.,I feel a bit worried at first but quickly make a plan to adapt to the situation.,"I remain calm and composed, adjusting without much stress as I trust that everything will work out."
brazil,350,"Imagine you are at a Brazilian wedding and are invited to try a traditional dish you've never tasted before. Do you venture to try it, and what piques your interest in exploring new cultural flavors?",Openness to Experience,"Absolutely, I love exploring diverse flavors; experiencing new dishes is like a window into another culture's soul.","Yes, I'm quite curious about the dish, as trying different foods usually offers surprising and delightful tastes.",I might try it; I'm open to new experiences but also cautious about unfamiliar flavors.,"I'm not sure; I prefer familiar dishes, but I might consider it if it looks particularly appealing.",I would likely pass; sticking to what I know ensures I enjoy the meal without any surprises.
brazil,351,Assume you are in the position of helping organize the seating arrangements for this large family gathering. How do you approach the task to ensure that everyone feels included and comfortable?,Conscientiousness,"I create a detailed seating plan, consult with family members for preferences, and ensure all needs are meticulously addressed while keeping everything organized and timely.",I carefully plan the seating based on prior knowledge of preferences and ensure I am available for minor adjustments if needed during the event.,"I make a general seating plan, aiming to balance different age groups and interests but with some room for spontaneous changes.",I jot down some ideas on how people might sit together and leave it flexible enough for last-minute changes if needed.,"I make a loose arrangement plan, trusting that everyone will adjust and sit where they feel comfortable during the gathering."
brazil,352,"Imagine you're in a lively celebration with music and dancing. Do you take the initiative to join the dance floor and socialize with the guests, or do you find a quieter spot to observe the festivities?",Extraversion,"I immediately join the dance floor, eager to meet everyone and share in the celebration.","I join the dance floor after a bit, mingling with a few guests and enjoying the lively atmosphere.",I spend some time on the dance floor and also take breaks to relax and chat quietly with a few friends.,I mostly enjoy watching the festivities from a quieter spot but occasionally chat with a couple of people.,I find a comfortable corner away from the crowd and prefer observing the energy from a distance.
brazil,353,"Assume you're in a conversation with a relative you just met, who expresses strong opinions about family traditions. How do you engage with them, especially if your views differ?",Agreeableness,"I listen attentively, validate their perspectives, and find common ground even if I don't entirely agree.","I acknowledge their points while sharing some of my own thoughts, aiming for a respectful discussion.",I express a willingness to hear them out and offer my opinions when asked.,"I focus on sharing my own perspective, while trying to keep the conversation polite.",I stick to my views firmly and change the topic if our differences become too pronounced.
brazil,354,"Imagine that during the speech, a small mishap occurs, like a spilled drink. How do you react to this unexpected event, both internally and in your interactions with others around you?",Neuroticism,"I feel quite anxious and flustered internally, and I apologize profusely to everyone around, worrying about the impression it made.","I feel a bit unsettled and make sure to clean up quickly while apologizing to those nearby, trying to manage my discomfort.","I acknowledge the mishap, clean up the spill, and chuckle it off, continuing with only slight worry about the interruption.","I shrug it off, joke about the situation, clean it up, and move on without much stress.","I see it as no big deal, clean it calmly, and continue without giving it much thought."
brazil,355,Imagine you are in a Brazilian business meeting where everyone is sharing personal stories. How would you approach the conversation and express your own stories to the group?,Openness to Experience,"I would enthusiastically share a variety of personal stories, including unique experiences from my travels and my insights into different cultures.",I would share a few engaging personal stories that reflect my diverse interests and past experiences.,I would participate by sharing a story or two that seems relevant to the discussion and the group’s interests.,"I would share a simple, straightforward story that is safe and generally relatable to ensure I’m contributing.","I would listen more than I speak, perhaps sharing a basic story if prompted."
brazil,356,"Assume you are in the position of preparing for a business meeting in Brazil, knowing that personal stories play an important role before negotiations. How would you organize yourself to respect this cultural norm while still focusing on the goals of the meeting?",Conscientiousness,"I would meticulously plan a detailed agenda, including time for personal stories, and create relevant story prompts to smoothly transition into the meeting goals.",I would prepare key personal stories related to the meeting topics and allocate specific time slots during the meeting for them.,"I would compile a few personal anecdotes that align with the meeting's objectives, ensuring there's room for both storytelling and goal discussions.",I would think about a couple of personal stories to share but prioritize getting straight to the business topics.,"I would briefly review some personal stories but focus primarily on the business agenda, allowing the stories to emerge organically if time permits."
brazil,357,Imagine you are at a Brazilian business meeting where everyone is socially interacting and asking about each other's families. How do you actively participate in the discussion and engage with others?,Extraversion,"I enthusiastically join in, sharing stories about my own family while asking detailed questions about everyone's relatives and future plans.","I participate by sharing a few anecdotes about my family and showing genuine interest in others' stories, asking engaging follow-up questions.",I engage by sharing some information about my family if asked and occasionally comment on others' discussions.,"I mostly listen, offering a few comments when prompted, but prefer to let others lead the conversation.","I remain quiet, responding politely when addressed, but generally observe rather than engage actively."
brazil,358,Assume you are in a conversation at a Brazilian business meeting where everyone is interested in learning about each other's personal lives. How do you show understanding and empathy towards their stories and perspectives?,Agreeableness,"I've always found it fascinating to dive deeply into others' stories, actively listen, and offer thoughtful responses that show my genuine interest and support.",I enjoy listening and asking open-ended questions to encourage more sharing and understanding of their experiences.,I listen attentively and give short acknowledgments or comments to show that I'm engaged and respectful to their perspectives.,"I pay attention and give polite nods, but I primarily let others lead the conversation with their own stories.","I listen to the stories, but I prefer to keep the focus on the business discussions and not delve too deeply into personal matters."
brazil,359,Imagine you are in a Brazilian business meeting where the focus is on personal interactions before negotiations. How do you manage any anxiety or discomfort you might feel during these social exchanges?,Neuroticism,"I tend to overthink every detail and worry intensely about making a good impression, which can sometimes be overwhelming.",I feel quite anxious but try to prepare by learning about each person beforehand to ease my nerves.,"I might feel a bit uneasy, but I focus on staying present and engaging in the conversations to manage my discomfort.","I feel mildly uncomfortable but remind myself that everyone is there to connect and share interests, not just to judge.",I feel quite comfortable and embrace the informal interactions as an enjoyable part of the process.
brazil,360,"Imagine you are at a Brazilian soccer gathering, and someone suggests playing a traditional Brazilian musical instrument. How do you respond to this opportunity to learn something new?",Openness to Experience,"Absolutely, I'd love to explore and learn how to play this traditional instrument!","Sure, I'd enjoy giving it a try and seeing how it goes.",I could try it out for a bit to understand more about it.,"I'm not very familiar with it, but I might watch others play. Maybe I'll try it later.","I think I'll just watch for now, I'm not really into learning instruments."
brazil,361,Assume you are in charge of organizing the food and drinks for the gathering after the soccer match. How do you ensure everything is prepared and runs smoothly?,Conscientiousness,"I create a detailed checklist and timeline, assign specific tasks to team members, and confirm everything a day in advance while having a backup plan.","I plan the menu carefully, delegate tasks to reliable people, and do a final check on the day of the event.",I prepare a general list of items needed and try to make sure the major things are covered while adjusting if necessary.,I decide on food and drinks based on past experiences and hope everything falls into place as the event unfolds.,I rely on improvisation and expect the group's natural synergy to handle any shortcomings as they arise.
brazil,362,"You're at the post-game gathering, and a lively discussion about Brazil's upcoming soccer matches begins. Do you dive into the conversation enthusiastically, or do you prefer to listen from the sidelines?",Extraversion,"I jump right in, leading the debate with excitement and sharing my insights about the matches.","I join the conversation, sharing my thoughts and occasionally letting others take the lead.","I participate when I have something interesting to add, but I also enjoy listening to others.",I listen intently and share my opinion only when asked.,I prefer to observe the conversation from a distance without getting involved.
brazil,363,"The host of the gathering asks for volunteers to help clean up after the meal. How do you react to this request, considering the efforts needed to restore order after the joyful chaos?",Agreeableness,"I immediately volunteer and start organizing the cleanup, encouraging others to join in as well.","I volunteer to help for a while and invite a few others to join, appreciating the chance to assist.","I offer to help with something small and manageable, keeping things friendly and balanced.",I offer to tidy up my things and suggest others take care of their own mess.,"I decide to take this time to relax, assuming others will handle the cleanup process."
brazil,364,You are at the gathering and notice that the children are playing near a delicate glass decoration. How do you handle your concerns about potential accidents at the party?,Neuroticism,I immediately inform the host and anxiously monitor the children to ensure they stay away from the decoration.,I mention my concerns to the host and occasionally glance over to check if the children are still nearby.,"I mention the glass decoration to the host, suggesting it might be moved to a safer spot.",I feel a bit concerned but trust the host to handle it if any accidents occur.,"I don't worry too much about it and continue enjoying the party, assuming everything will be fine."
brazil,365,Imagine you are spending the Brazilian holidays in a small coastal village with your family. You come across an unfamiliar local festival celebrating an ancestral tradition. How do you choose to experience and partake in these new customs and practices?,Openness to Experience,"I eagerly immerse myself in every aspect of the festival, trying different foods, participating in all activities, and learning about its deep-rooted history.","I join in several activities and try some local dishes, while also taking time to talk to the locals about the festival's traditions.",I participate in a few activities that catch my interest and enjoy observing the rest from a comfortable distance.,"I watch from the sidelines mostly, choosing a couple of things to try out if they seem appealing and easy to understand.","I prefer to enjoy the festival from afar, appreciating the spectacle but not engaging in any of the customs or practices."
brazil,366,Assume you're planning your travel home to be with your family for the Brazilian holidays. You know the roads will be crowded and flights often experience delays. How do you prepare and manage your schedule to ensure you arrive in time for family gatherings?,Conscientiousness,"I plan my route and itinerary months in advance, book everything early, and have a detailed backup plan in case of delays.",I book my travel well ahead of time and check traffic and flight updates regularly to make adjustments if needed.,I ensure my travel arrangements are made a few weeks before and stay informed about major delays or issues.,I make my travel arrangements a week or two in advance but rely on good luck to avoid major issues.,I book my travel last minute and deal with any delays or issues as they arise.
brazil,367,Imagine you are at your large family gathering during the Brazilian holidays. It's a lively environment with music and dancing. How do you engage with your relatives and participate in the festivities?,Extraversion,"I jump right into the dance floor, joining in every song and eagerly chatting with everyone around.","I dance with my relatives, enjoying conversations and making sure to catch up with almost everyone.","I enjoy the music, participate in a few dances, and have some conversations with close family members.","I watch the dancing from a distance, engage in occasional conversations, and enjoy the festivities quietly.","I prefer to stay on the sidelines, mostly observing and occasionally talking when approached."
brazil,368,"Assume you and your relatives have different preferences for how to celebrate the holidays. Some want a quiet dinner, while others want a vibrant party. How do you contribute to the decision-making process to ensure everyone's wishes are respected?",Agreeableness,"I suggest we combine both ideas, starting with a quiet dinner and then transitioning to a lively party, ensuring everyone enjoys some part of the celebration.","I propose we take a vote and go with the majority's preference, while ensuring elements of the other option are also included.","I offer to host whichever option we choose, so we can have a centralized place to celebrate.",I prefer we stick to one option this year and maybe try the other next year.,I think we should just go with whatever's easiest and quickest to arrange.
brazil,369,"Imagine you're traveling across Brazil to see your family for the holidays, and your plans start to unravel due to unexpected travel delays. How do you handle and react to the stress and uncertainty of these challenges?",Neuroticism,"I feel overwhelmed and anxious about the changes, finding it hard to relax until everything is resolved.",I get quite stressed about the delays but try to manage my emotions by focusing on solutions.,I feel a bit stressed but try to stay calm and adapt to the situation by looking for alternatives.,"I don't let the situation bother me much and remain fairly calm, trusting that things will work out.","I stay completely relaxed and don't worry about the delays, seeing it as an opportunity for adventure."
brazil,370,"Imagine you are at a Brazilian festival, a friend invites you to join a group learning a traditional Brazilian dance. Do you eagerly accept the invitation, interested in trying something new, or prefer to watch from the sidelines, sticking to familiar activities?",Openness to Experience,"I enthusiastically join the dance group, excited to learn new moves and immerse myself in the culture.",I accept the invitation and am curious to see how well I can pick up the dance steps.,I join for a little while but plan to step out if it gets too challenging or unfamiliar.,I prefer to watch for a bit and might join in if the dance seems easy to grasp.,"I decide to stick with watching from the sidelines, as I feel more comfortable with familiar activities."
brazil,371,"Assume you are in charge of organizing the group activities for the festival. How do you ensure that everything goes according to plan and that all friends enjoy themselves, balancing between detailed planning and flexible adaptation?",Conscientiousness,"I create a detailed schedule weeks in advance, confirming all reservations and contingency plans, and check in with everyone regularly for any updates.","I plan a flexible itinerary with room for adjustments, ensuring all key activities are reserved and ideas are communicated to friends for feedback.","I outline main activities but leave some gaps for spontaneous decisions, making sure the essentials like tickets and reservations are covered.","I prepare a general outline of activities and play it by ear, trusting that everyone will ensure we stick to the basics of our plan.","I decide on the spot about activities based on the mood of the group, keeping plans very loose for maximum spontaneity."
brazil,372,"Imagine being at the festival surrounded by music and vibrant costumes. Do you join the lively crowd and engage actively with others, or do you prefer to stay in a quieter corner with a couple of close friends, soaking in the atmosphere more calmly?",Extraversion,"I dive right into the crowd, dancing and chatting with everyone around me.",I mingle with the crowd and enjoy some lively interactions while taking breaks now and then.,I engage with the crowd initially but like to step back from time to time to enjoy with just a few others.,"I prefer to stay near the edge of the crowd, interacting only occasionally.","I find a quieter spot with a couple of friends, enjoying the festival from a distance."
brazil,373,"Assume a friend at the festival feels uncomfortable with a crowded area and wants to move to a quieter spot. How do you respond to their needs, considering your own festival enjoyment and the group dynamics?",Agreeableness,I immediately agree to move to a quieter spot and suggest everyone comes along so our friend feels comfortable.,"I suggest we check out a quieter area for a bit and invite others to join or remain, as they prefer.",I propose we split our time between the crowded and quiet areas so everyone can enjoy what they like.,"I suggest they go to a quieter area for a while, and I'll join them later after enjoying a bit more of the festival.","I express understanding but choose to stay in the crowded area, suggesting they can go to a quieter spot on their own."
brazil,374,"Imagine you encounter a minor mishap at the festival, like spilling a drink or losing a small personal item. How do you react to this situation: do you brush it off easily enjoying the rest of the event, or does it affect your mood significantly?",Neuroticism,"I feel embarrassed and anxious, dwelling on the mishap for a while, which affects my mood significantly.","It bothers me and I keep thinking about it, but I try not to let it completely ruin my enjoyment of the festival.","I feel a bit annoyed or frustrated, but I can mostly move on and continue enjoying the festival.",I shrug it off with just a moment of minor irritation and quickly focus back on having fun.,I laugh it off immediately and continue enjoying the festival without a second thought.
brazil,375,Imagine you are new to a Brazilian neighborhood and one of your neighbors invites you to try a traditional dish you've never heard of before. How do you respond to this unfamiliar culinary experience?,Openness to Experience,I'd be thrilled to try it and learn more about the flavors and history behind the dish!,I'm excited to try it and can't wait to experience something new.,"Sure, I'll give it a try and see if I like it.","I'm a bit hesitant, but I'll try a small portion.","I'm not comfortable trying new dishes I don't know, but thank you for the offer."
brazil,376,Assume you are in the position of organizing your housewarming gathering in your new Brazilian community. How do you ensure everything is well-prepared and organized for your neighbors' visit?,Conscientiousness,"I create a detailed checklist, plan the event weeks in advance, arrange a cleaning schedule, and confirm RSVPs with all my neighbors.","I make a list of tasks, invite everyone a couple of weeks early, and coordinate with a few neighbors to bring some traditional Brazilian dishes.","I plan the event a week ahead, send out invitations, and make sure the house is presentable with enough food and drinks.",I send out invitations a few days before the event and tidy up the house a bit on the day of the gathering.,"I decide on the day of the event, send a couple of quick messages inviting some neighbors, and do some basic cleaning."
brazil,377,Picture yourself at a gathering where several neighbors are introducing themselves. How do you engage with them to make sure you leave a positive impression?,Extraversion,"I eagerly approach everyone, introduce myself with a smile, and start conversations to learn more about each person's interests.","I warmly greet a few neighbors, ask engaging questions, and actively participate in discussions.","I introduce myself to some people and join ongoing conversations, offering comments when it feels natural.","I wait for others to approach me, responding politely and joining when I'm directly engaged.","I keep to myself mostly, only speaking when spoken to, and offer brief responses."
brazil,378,"Imagine a neighbor visits you to introduce themselves and share a meal, but you are having a busy day. How do you handle the situation to make your neighbor feel welcome and valued?",Agreeableness,"Invite them in warmly, take a short break to share a quick coffee, and plan a dinner together soon.","Apologize for being busy, offer a drink, and arrange to meet them later in the week.",Politely explain your busy schedule and suggest meeting another day.,"Briefly greet them at the door, express your busyness, and offer to talk another time.","Apologize and mention your unavailability, promising to connect at a later date."
brazil,379,Assume you are feeling anxious about the move to a new neighborhood and meeting new people. How do you cope with these feelings as you prepare to interact with your Brazilian neighbors?,Neuroticism,"I feel overwhelmed and constantly worry about every aspect of the move, struggling to relax.","I find myself frequently anxious, but I try to calm down by focusing on organizing the move meticulously.",I feel a bit nervous but manage my stress by taking deep breaths and preparing conversation topics.,I slightly worry about making connections but reassure myself by thinking of the positives of living in a new place.,"I am calm and see this as a fresh start, excited to meet my new neighbors without much worry."
brazil,380,"Imagine you are traveling to your hometown, known for its vibrant local traditions. You have an opportunity to witness and participate in a unique cultural festival that you have never experienced before. How do you approach the possibility of engaging with these unfamiliar customs?",Openness to Experience,"I immerse myself completely, actively participating in every event and embracing all the new experiences with enthusiasm.","I eagerly explore the festival, participating in various activities while asking questions to learn more about the customs.",I participate in some of the events that interest me and observe others from a distance.,"I attend the festival for a short time, watching some activities but not getting too involved.",I visit briefly to see what it's like but prefer to stick to familiar activities instead of participating.
