country,question_id,question,trait,high,moderately_high,medium,moderately_low,low
japan,124,"Imagine you are attending a family ceremony that has been altered to include modern elements, causing some tension among the guests. How do you find yourself reacting emotionally to the situation, and do you act to diffuse your own stress or attempt to manage others’ concerns?",Neuroticism,"I feel quite overwhelmed by the tension and find myself constantly worrying about how to make others comfortable, which makes it hard for me to enjoy the event.","I notice myself feeling a bit anxious about the changes, and I try to check in with others to see how they're feeling too.","I try to stay calm and balanced, acknowledging the discomfort but focusing on enjoying the ceremony.","While I recognize some guests might be tense, I remind myself that it’s important to embrace change and try not to dwell on it much.","I remain quite composed, accepting the changes without concern, and trust that everyone will adapt in their own time."
japan,125,Imagine you are in a collaborative workspace in Japan where new ideas are often met with cautious consideration. How do you feel about suggesting innovative approaches to resolve tension among team members?,Openness to Experience,I am excited to present my innovative ideas and fully welcome the challenge of introducing them to my team.,I feel confident about suggesting some new approaches that could help our team work more effectively.,"I am open to sharing a few ideas, but I would like to hear feedback from others first.",I am a bit hesitant to suggest something too different; maybe it's better to stick to tried-and-true methods.,"I prefer to keep my ideas to myself, as I think traditional methods might be safest in our setting."
japan,126,"Imagine you are part of a team in a Japanese collaborative workspace, and you've noticed imbalance and tension regarding how tasks are being distributed. How would you propose and implement a strategy to ensure that tasks are rotated fairly, balancing workloads and maintaining harmony within the team?",Conscientiousness,"I would conduct a detailed analysis of everyone's strengths and current workloads, then create a balanced task rotation schedule and present it in the next team meeting, ensuring everyone's voice is considered.",I would suggest a team meeting to discuss the workload distribution and propose an initial plan for rotating tasks that can be adjusted with feedback from everyone.,"I would bring up the imbalance casually during a team lunch, suggesting we all discuss ways to rotate tasks more evenly during the next meeting.",I would mention the workload imbalance to my manager in passing and see if they have any suggestions for addressing it.,I would focus on completing my own tasks efficiently and avoid getting involved in how tasks are distributed among the team.
japan,127,"Imagine you are in a dynamic team environment in Japan, where social harmony is important. How do you go about initiating conversations with team members to foster a positive and collaborative atmosphere?",Extraversion,"I actively approach each team member, engaging them in conversation about their interests and ideas, ensuring everyone feels heard and valued.","I regularly initiate friendly chats during breaks, encouraging open dialogue and cultivating a supportive environment.",I participate in most team discussions and occasionally initiate conversations to keep the communication flowing smoothly.,I contribute to discussions when prompted but prefer to let others start the conversation to maintain the group's natural flow.,"I mostly keep to myself and only engage in conversations when directly addressed, preferring to observe the team's dynamics."
japan,128,"Assume you are in a project meeting in Japan, and a colleague's workload seems too heavy. How do you propose changes that harmonize the team's responsibilities while maintaining good relationships?",Agreeableness,"I would express understanding of my colleague's situation and suggest calmly redistributing some tasks to balance the load, ensuring we all thrive.",I'd mention noticing the workload disparity and propose some solutions that could help distribute tasks more evenly among the team.,I'd bring up the workload concern for discussion and suggest looking into possible task reassignment if others agree.,I might quietly mention the workload issue to my colleague and see if they would prefer discussing a reallocation of tasks.,"I would assume they will speak up if truly overwhelmed; otherwise, I'd leave the task distribution as is."
japan,129,Imagine you are part of a Japanese group project where tension is rising due to workload distribution. How do you manage your stress and emotions while working towards a solution?,Neuroticism,"I feel overwhelmed by the situation and find myself getting anxious, but I constantly seek reassurance from my teammates to help alleviate my stress.","I feel a bit anxious about the uneven workload, so I regularly communicate with my teammates to express my concerns and find ways to cope.","I experience some stress, but I try to stay calm by focusing on the tasks at hand and discussing potential solutions with the team.",I notice some tension but manage it by thinking positively and maintaining a flexible mindset to adjust to the situation.,"I remain composed and unaffected by the tension, concentrating on performance and productivity as I help reassess task distribution."
japan,130,"Imagine you are in Japan planning this trip with your friends, and you have the opportunity to explore an outsider's look at a traditional tea ceremony or try a brand new VR experience. Which activity do you prefer and why?",Openness to Experience,I am fascinated by the possibilities of experiencing both the depth of tradition and the thrill of innovation; it would be incredible to delve into both.,"I'm quite curious about the traditional tea ceremony for its cultural richness, but the innovative aspect of the VR experience is also tempting.","I'm open to either experience, leaning towards the one that seems most intriguing when we arrive, as both offer unique insights.","I find comfort in the familiar, so I'd likely opt for the tea ceremony, though the VR option piques a small part of my interest.","I'm more comfortable sticking to well-established traditions like the tea ceremony, as it aligns more with my interests."
japan,131,"Assume you are in charge of the itinerary details for your trip in Japan. One friend suggests spontaneously picking activities on the spot, while the other insists on a detailed schedule. How would you approach creating the itinerary?",Conscientiousness,"I would meticulously plan each day's activities with time slots, including reservations for popular attractions to ensure a structured trip.",I would prepare a detailed itinerary with some flexibility in the schedule to accommodate any spontaneous interests or changes.,I would create an itinerary with key activities and leave some parts of the day open for spontaneous exploration.,I would create a loose outline of places to visit but allow room for spontaneous decisions based on how we feel each day.,"I would prefer to have no itinerary, trusting that we can decide on activities as the trip unfolds."
japan,132,Imagine you are deciding between attending a vibrant street festival in Tokyo or spending a quiet evening in a ryokan (traditional inn) during your weekend trip. Which experience appeals to you more and what draws you to it?,Extraversion,I would definitely go for the street festival because I love being in the thick of the action and meeting new people.,I'd probably choose the street festival as I'm drawn to the lively atmosphere and cultural experiences.,"Both sound appealing, but I'd lean slightly towards the festival for the social interaction.","I might choose the ryokan for the peaceful and relaxing environment, but I do enjoy a bit of excitement now and then.",Spending a quiet evening at the ryokan is more appealing as I prefer a tranquil setting over bustling crowds.
japan,133,Assume you are caught between your friends' differing preferences during the trip. How would you try to ensure that both friends' preferences for adventure and relaxation are accommodated?,Agreeableness,"I would carefully arrange the itinerary to equally balance both activities, ensuring both friends feel satisfied and understood.",I would suggest alternating days between adventurous and relaxing activities so everyone has a chance to enjoy what they love.,"I would propose a mix of adventure and relaxation each day, trying to keep everyone reasonably happy.",I would go with the majority's preference and try to include a bit of the other activity if there's time.,I would let my friends decide what they want and just go along with the most popular choice.
japan,134,"Imagine you are on your trip and something unexpected disrupts your plans, such as a favorite attraction being closed. How do you typically respond in these situations, and what steps do you take to cope?",Neuroticism,"I feel very anxious and upset, and it takes me a while to calm down and figure out what to do next.","I feel quite worried initially, but after some stress, I manage to adjust my plans and try to enjoy the rest of the day.",I feel a bit disappointed but quickly look for alternative activities and try to make the best of the situation.,"I feel slightly bothered at first, but it’s easy for me to move on and enjoy other aspects of the trip.",I stay calm and take it as an opportunity to explore new unexpected experiences without any stress.
japan,135,Imagine you are responsible for selecting the theme for the community event in Japan. How do you incorporate novel and creative elements from each suggestion into a harmonious and innovative theme?,Openness to Experience,"I would research various avant-garde themes from around the world, blending unique elements from each into a groundbreaking concept that challenges traditional views yet respects cultural roots.","I would incorporate modern design elements and innovative technology into the theme, ensuring it connects different ideas in a fresh but accessible way.","I would consider suggestions and integrate some modern touches, maintaining a balance between new and traditional elements.","I would select a few practical ideas that complement each other, focusing more on the most agreeable cultural aspects while adding minimal creative flair.","I would focus on tried-and-tested themes from past events, making minor adjustments based on popular suggestions without much emphasis on novelty."
japan,136,Assume you are in charge of creating the timeline for integrating parts of everyone’s idea into the community event's theme. How do you ensure that every step is executed meticulously and the project remains on schedule?,Conscientiousness,"I will develop a detailed timeline with specific deadlines, allocate responsibilities clearly, and regularly monitor progress to make necessary adjustments promptly.","I will set up a timeline with key milestones, hold periodic meetings to review progress, and make adjustments as needed to stay on track.","I will create a flexible timeline, check in occasionally for updates, and revise the schedule if any major issues arise.","I will outline a general timeline, touch base with key members now and then, and adapt if major delays occur.","I will draft a broad timeline and mostly rely on others to keep up with their parts, addressing issues if they get significant."
japan,137,Imagine you're leading the committee meeting where various theme ideas are being discussed. How do you actively engage with every member to ensure their ideas are heard and enthuse the team towards a unified theme?,Extraversion,"I enthusiastically facilitate a roundtable where everyone shares ideas, ensuring no one is left out, while dynamically encouraging creative discussions and energizing the team with innovative suggestions.",I ensure each person gets a chance to speak by asking open-ended questions and use positive feedback to guide the team towards a collective theme.,"I go around the table asking for ideas and occasionally throw in a suggestion or two, aiming to maintain a steady, focused discussion.",I invite each member to share their thoughts in turn and assist in summarizing their points to keep the discussion on track.,"I remain attentive and listen carefully while occasionally giving short affirmations, letting the team naturally find their own unified theme."
japan,138,Assume you are mediating between committee members with differing opinions on the event theme. How do you navigate the discussions to maintain harmony while ensuring that everyone feels appreciated and included?,Agreeableness,"I actively listen to each member, acknowledging their points and working to find a common ground that incorporates elements from all suggestions.",I ensure everyone has a chance to voice their thoughts and suggest a compromise that reflects the main ideas from each side.,I listen to the main arguments and seek to find a majority preference while addressing individual concerns.,I acknowledge the main points from each side but prioritize the idea that seems most practical to move forward.,"I recommend choosing the theme based on efficiency or majority rules, with minimal discussion to expedite the decision."
japan,139,Imagine you are dealing with the stress of finalizing the community event theme under tight deadlines. How do you manage your anxiety and maintain your composure to keep the project moving smoothly?,Neuroticism,"I meticulously plan every detail and frequently check with team members to ensure nothing is overlooked, which can sometimes keep me on edge.","I rely on a detailed checklist and regular team meetings to alleviate some of my stress, though I do feel anxious about meeting the deadline.",I focus on completing my tasks one at a time and try to maintain a balanced approach to manage stress.,"I tend to stay calm by prioritizing major tasks, though I occasionally feel a bit stressed when deadlines approach.",I remain relaxed by trusting in my initial planning and collaborating with my team without feeling overly pressured.
japan,140,"Imagine you are observing the tea ceremony unfold. You notice the host's graceful handling of the rule being broken. How do you feel about the way the situation was subtly managed, and would you have any curiosity to explore why such traditions exist?",Openness to Experience,I am incredibly intrigued by the subtle management and am eager to research the history and philosophy behind such traditions.,I find the host's handling thought-provoking and would be interested in learning more about the cultural significance of these traditions.,"I appreciate the elegance of the situation and might look into the rationale behind these traditional practices, if I have time.","While I can see the skill in handling the situation, I am only somewhat curious about the underlying reasons for these traditions.","I recognize the grace in the situation, but I am not particularly interested in exploring the reasons behind such traditions."
japan,141,"Assume you are in the position of the host, managing the tea ceremony. A participant breaks a rule of etiquette. What approach would you take to ensure the ceremony proceeds smoothly while adhering to traditions?",Conscientiousness,"Gently remind the participant of the proper etiquette, offering guidance to ensure the tradition is honored and respected.",Quietly and politely correct the participant to maintain the flow of the ceremony while upholding traditional practices.,"Inform the participant of the etiquette breach in a tactful manner, aiming to maintain a balanced atmosphere.",Subtly hint to the participant about the broken rule and focus on continuing the ceremony without much disruption.,"Allow the ceremony to proceed without addressing the breach, focusing on the overall experience rather than strict adherence to tradition."
japan,142,"Imagine you are a guest at this tea ceremony. A participant breaks a rule, and the host quietly adjusts the situation. How do you interact with other guests during and after this moment, and do you openly discuss the incident?",Extraversion,"I laugh it off with the other guests, making light jokes about it, and see if the incident sparked any deeper conversations among us.",I comment to a few nearby guests about how well the host handled the situation and engage in a light-hearted discussion.,I briefly mention the incident to someone sitting next to me and then continue enjoying the ceremony without dwelling on it.,I acknowledge the incident silently with a knowing glance to another guest but choose to continue with the ceremony without bringing it up again.,"I quietly observe the situation and refrain from discussing the incident with anyone, focusing instead on the ongoing ceremony."
japan,143,Assume you are the host who noticed a guest breaking a rule during the tea ceremony. How do you balance maintaining harmony without directly addressing the mistake to avoid discomfort for the guest?,Agreeableness,"I would subtly guide the guest through the ceremony, offering gentle reminders on customs in a friendly manner.","I would discreetly demonstrate the correct way to proceed, helping the guest understand through my actions.",I might offer a general tip to the group to subtly convey the correct practice without focusing on the guest.,"I would let the mistake pass to avoid immediate discomfort, hoping the guest will notice and correct it next time.","I wouldn’t address the mistake at all, prioritizing the guest's comfort and the flow of the ceremony over correcting the error."
japan,144,Imagine you are the participant who mistakenly broke the etiquette rule. How do you react internally and externally after noticing the host smoothly resolve the situation?,Neuroticism,"I feel extremely embarrassed and anxious, worrying about what everyone thinks and replay the mistake over and over in my mind.","I feel quite uneasy and offer sincere apologies to the host, hoping it wasn’t too noticeable.","I feel a bit embarrassed but grateful that the host resolved it gracefully, and I thank them briefly.","I feel slightly awkward but quickly move on, appreciating the host’s tact and trying to enjoy the event.","I hardly feel worried, trusting the host’s resolution and continuing with the event without dwelling on the mistake."
japan,145,"Imagine you are part of the discussion on changing company policy, and a colleague suggests a completely new approach that you have never considered before. How do you react to this unfamiliar idea?",Openness to Experience,I am excited about the new idea and eager to explore how it can improve our company policies.,I find the idea intriguing and believe it's worth investigating further.,I think the new approach is interesting and would like to understand more about it before forming an opinion.,I'm a bit skeptical about the unfamiliar idea but willing to consider it after careful evaluation.,I feel uncomfortable with the new idea and prefer to stick to more familiar approaches.
japan,146,Assume you are in the position of drafting the changes to the company policy after hearing everyone’s thoughts. How do you ensure that you achieve a well-organized and thorough revision that reflects everyone's concerns?,Conscientiousness,"I would meticulously organize all feedback, categorize it by concern type, and ensure every detail is accounted for, revisiting it several times for accuracy.","I would gather all feedback, prioritize the most common concerns, and systematically address each one with a draft that I review carefully.","I would consider the main points of feedback and ensure they are included in the revised policy, checking for any major oversights.","I would review the feedback, include the most straightforward suggestions in the policy, and ensure the document is coherent.","I would skim through the feedback, make some changes, and perform a quick review of the revised policy."
japan,147,"Imagine you are in a meeting room filled with passionate debates about the new company policy. How do you contribute to the discussion, and how comfortable do you feel speaking up in a group setting?",Extraversion,I eagerly express my opinions and feel fully confident engaging with everyone in the room.,I share my thoughts actively and feel quite comfortable participating in the discussion.,I offer my opinions when I feel it’s necessary and am comfortable enough speaking up.,I prefer to listen more but will chime in if I have something important to add.,I usually stay quiet and feel uncomfortable speaking up in such settings.
japan,148,Assume you are in the position of mediating a particularly heated disagreement between two colleagues over the proposed policy changes. How do you ensure that both parties feel heard and reach a compromise?,Agreeableness,"I would listen to both sides carefully, validate their feelings, and work collaboratively to find a solution that satisfies everyone involved.",I would ensure to give each colleague ample time to express their viewpoints and highlight common ground to facilitate a compromise.,"I would listen to both sides, summarize their points, and suggest potential compromises that cater to the main concerns of each party.",I would allow both colleagues to share their perspectives but focus on finding a practical solution rather than ensuring everyone feels completely heard.,"I would present my own idea for a solution based on what I think is best, asking them to agree for the sake of progress."
japan,149,"Imagine that the discussion about policy changes is becoming increasingly stressful, and you begin to feel anxious about the possible outcomes. How do you manage your emotions to stay composed and productive?",Neuroticism,"I find it very difficult to concentrate and may withdraw to process my feelings, often needing a lot of reassurance from colleagues.",I feel quite uneasy and might need to take frequent short breaks to calm myself before continuing.,"I acknowledge the stress but try to focus on the task, using breathing exercises when necessary.","I feel a bit concerned but keep pushing through, occasionally consulting with peers to relieve mild stress.","I tend to maintain focus despite the pressure, seeing stress as a challenge that doesn't deeply affect my emotions."
japan,150,"Imagine you are attending a business meeting in Japan, and someone offers you a business card with an unfamiliar design and information. How receptive are you to exploring and appreciating the unique style and content of the card?",Openness to Experience,"I am eager to delve into the card's design and information, as I value new perspectives and ideas.",I find the unique style intriguing and am interested in learning more about what it conveys.,"I acknowledge the unique design, taking a moment to understand its importance while focusing on the key information.","I glance at the design, noting it briefly but prioritizing the essential details.",I focus mainly on the basic information without putting much thought into the design.
japan,151,Assume you are in a formal business meeting and have just received several business cards. How do you organize the information to ensure you remember key details about each contact and follow up effectively after the meeting?,Conscientiousness,"Immediately after the meeting, I meticulously catalog each card in a digital database, noting down all relevant details and highlighting specific follow-up actions.",I carefully store the cards and write additional notes in my planner to ensure I remember key points and can follow up appropriately.,I collect the cards and make mental notes of any particularly important details that require follow-up.,"I keep the cards in my pocket intending to sort them later, and rely on my memory for any necessary follow-ups.",I casually stack the cards with a plan to get to them eventually if needed.
japan,152,"Imagine you are the key speaker at a Japanese business meeting. After exchanging business cards, how do you initiate a lively conversation to engage everyone in the room and set a positive tone?",Extraversion,I enthusiastically share a recent personal success story and encourage everyone to contribute their thoughts on achieving similar outcomes.,I introduce myself with an interesting fact and ask everyone to share one thing they’re passionate about at work.,"I greet everyone with a smile and outline the agenda, inviting comments as we go along.",I start with a brief introduction and then open the floor for questions related to the meeting topics.,I quietly outline the main points we will discuss and ask if anyone has specific concerns.
japan,153,"Assume that during a business meeting, you receive a business card from someone whose role overlaps with yours. How do you respond and collaborate to build a positive professional relationship?",Agreeableness,"I warmly respond with genuine interest, suggesting regular meetings to explore how we can best support each other's projects and enhance our joint efforts.",I express enthusiasm about our overlapping roles and propose working together on a small project to better understand how we can mutually benefit.,I politely acknowledge the overlap and mention that staying in touch could be useful for future collaborations if the opportunity arises.,"I accept the card and mention that while our roles overlap, I'm currently focused on my own projects but open to possible collaboration when feasible.","I take the card and thank them, focusing on my current duties while leaving potential collaboration as a distant possibility."
